sentence,label
 One day night la nadakkura story mathri iruku,neutral
 Thala & U1 Combo Vera level,positive
 Ethana peru ethu maari padathula ajith nadikanum nu nenaikuriga?,negative
 raijini than massmy age18 na rajini fqn,positive
 Etho onnu miss aguthu pa... etho onnu,negative
 enna mathiri thala veriyarkal oru like podunga,positive
 Enaku padame partha maari oru Feeling uuu,positive
 Thalaivar varuvaru sure aa adippaaru,neutral
 Krish movie fans like here  :call_me_hand:,neutral
 Thala entry Epdipannunga thala rathangale,positive
 Eppa yenna porom...sugar mathara poda porom..,negative
 Trailer na  ipdi irukanum!!! Maasssssss,positive
 Siruthaiuylaum karthiku ponnu irukum kavalan flop  Apo bigil,neutral
 Padippa yaralayum edutthukka mydiyaathu intha dialogue rompa arumaiyaga irukku.  Vekkai naaval vendum.,positive
 Avulo scene lam illa romba paravalaya iruku,positive
 Yuvan BGM semma mass aha irukku...,positive
 Seems like it’s gonna cross Pink.,positive
 Thala voice ketgavea thirupa thitupa paakura,positive
 No. 1 trending laye Romba nal irundha likes adhigama varum so Pangalingala adichi thookalamaa ‍‍‍‍,negative
" school boys innum tution pogala pola,dislike button ah pudichu nonditu irukkanuga",neutral
 Trailer me khi din to hua hi nhi h,positive
 Ketta paiyan sir indha Kaali.  I’m a bad boy.,positive
 Thatrailer naa idhu than da,neutral
 Kamla hasan is a ass hole,negative
 Sweet sapda porom apram sugar mathira sapda porom,neutral
 No words thalaaaaaaaa Marana mass trailer tala,positive
 Scene like remake....from hindi movie PINK ....,positive
 Bgm score avlo serappa illa sam dei yeppa pathalum bgm gura perla kathitae iruka,neutral
 Thala maturity vera level in last dialogue oruthar ku viswasam kata inoruthar ah asinga padutha vendam,positive
 Ipo trending no 1 la entha trailer iruku,positive
 SUPER STAR only rajani sir SEMA mass:smiling_face_with_open_hands::smiling_face_with_open_hands:,positive
 adengapa innum nooru varsam alnalum thalaivar gethu than poga,positive
 Wothalaivaaaaaa semma i love u rajini sir,neutral
 Oru padam Kamal Mari Oru rajini Mari  thala,positive
 Trailer pidikalana poga vendiyadhu dhane yedhukandi dislike ahhhhhh ..... Yarrupa andha karuppu aadunga,positive
 English movie trailer Mari irukku....scenes with dialogues.... natchatira nayakanin aatatha paarka marana waiting....,positive
 Love You Super star ;) Mega Serapu,positive
 Ada paavigala Hindi PINK movie ah apdiye copy cat ah? Why did you do like this ?,neutral
 Sooper Pettai Trailer S Bajrangi Baaijaan film la Nawasuddinpolice pettai la villain aa?,positive
 Trailer pakrathuku munadiye like potavanga..hit like,negative
 Inga yaaralla vijaysethupathy kaaga petta poringa,neutral
 Ellam avan sayal movie mathiriya irukku:thinking_face:,neutral
" Honestly, the trailer looks just just ok.",negative
 Thalaivaaaaaaa....edhu edhu edhudha.....vayasanalum unga style ungala vittu pogala......,positive
 bgm kgf bgm modified mathiri iruku,negative
 Thanks fans from karnataka hit like here,positive
 Enada vivegam la coffee solu  nu solra mathri sweet sapda porom  nu cooola solraru thalaivaru!,positive
 Semma semma ... Payangaram.. superb Vera level...,positive
 Manitha kadavul Super star Rajini Kanth THALAIVAAAA :sign_of_the_horns::sign_of_the_horns::sign_of_the_horns:,positive
 Any Malayalies   Rajani Sir Hit like Here,neutral
" Ipdi niraya ,niraya,niraya thala hit kuduparu ,that is thala.",positive
 indian movies goes intra national levels woow,positive
 Super petta  6 days to go for movie,neutral
 Telugu lo kuda release cheyavachhuga machha,neutral
" Saavuradha irundhalum sanda potu saavanum, Bayandhu saaga Koodadhu  Apt for Diwali Release scenario",positive
 John Wick - Vikram version,positive
 Pathu kita irukka....... Can't stop..... Sk love  you:smiling_face_with_hearts:,negative
 Rajini sir telugu fans hit a like here ? Rajinified,positive
 Thalaiva veriyans    put a like....,negative
 Vijay Sethupathi is Back nu Soldravanga Vandhu Kila Kuthunga... Likela,negative
 Ajith look kola mass irukku,positive
 Ask dhul  chella kutti super altimate thala. Therika vidalam.,positive
 Ulitemate star Thala Ajith Kumar valga,positive
 Simply supere pu....appu viswasam kusuvasam athan pu...,positive
 Thala mass ... yuvan ultimate ...,positive
 ELLARUM VAIYILA VIRALA VEIKIRA ALAVUKU THARAMA SAMBAVAM IRUKKU THALA DAAA!,positive
 Dhanush + Vetrimaaran + GV,positive
 Ethana per pakkiringanu konjam like podunga appathan therium pls,positive
 Theater Kaliyala  Ranakalam Avapothu   THALAIVER ROCKSSSSSSSSSSSSSSSSSSSSSSSS,positive
 Movie Paathachu kandippa  ellarum pakkanum vera level la irukku movie Dhanush Anna Acting marana mass ah irukku,positive
 Only One The Super One Thalaivaaaaaaaaaaaa,positive
 R U Verjin...?  Semma Mass Question,positive
 Youtube hang aaych views kaatamaatingith but likes increase aaykitte irukk,positive
 TOTAL 29.5 VIEWS 40 HOURS SUPER THALAIVAAA WORLD SUPER STAR   MASSSSSSS,positive
 Petta a new favourite Rajini film after Sivaji,positive
 Ungala nambi 1500 VA ku ticket yadukalama,negative
 1 million likes kondu varanum keep share THALA bloods...,positive
 Rangaraj Pandey Rangaraaj Pandey Rangaraaj Pandey Rangaraaj Pandey,positive
 rasithu rusichi sethuki yirukkar karthik suburaj...,positive
 Pakathane pora indha Kaali oda aatatha vera level dialogue thalaiva,positive
 Kola gaandu la irukkan!  Sweet sapadu porom! Style ah? Naturally...,positive
 marninng elunthu undan thala tharishanam thaan,positive
 Karthi anna dialogue delivery class masssss,positive
 Wow.... V r waiting..... Thala pola varummaaaa,positive
 Outstanding vfx output! Hardwork never fails! Thalaivaaaaaaaaaaa! Unga kaal thoosu kooda evanam illai!,positive
 Iam thala fan asuran trailer super,positive
 72 k view 76 k like,neutral
 Action king Arjun fans like here,positive
 Watched bigil and kaidhi... Bigil good Kaidhi VERITHANAM...,neutral
 Yepppaaaaaaaaaaaa yepppaaaaaaaaaaaa a aaa Enna massuuu enaaa maaassssu thala eppavume masss da block buster film conform,positive
 Aiyoo Thala.. Vera level.. .. Marana mass...,positive
 Daily 10 times ku intha trailer pakuran.,positive
 Thala mass Dialogue  Therika vidalama madri padam irukum solravanga mattum like podunga,positive
 Anna final touch ok na  I am a Vijay fan,positive
 Intha padathula ms.dhoni ya pathavanlam like pannuga,positive
 Kolakandla irruka pudichavanga like here,positive
 Trailer vanthu evaluvu neram aguthu  Enga trendingla canom,positive
 Ajith ayo sema va thala va thala,positive
 Kola kandle irukke padathe pakkame irukka mudiyathu. Trailor superrr,positive
 Yeppa..  Enna screen presence... Oru vela pei padama irukumo..,positive
 Jst 1k more to hit 800k likes  Come on!!!,positive
 Adengappa vera lvl Shankar Sir pinnitingha vera lvl sir,positive
 Yenda KRISH maska copi adichi vachirukkinga....!!:face_with_monocle:  Puthusa ethavathu design pannirukkalam...!,neutral
 Ranjith kita irundhu engala kapathitanga nanri subburaj,positive
 Siva samy fans hit like here,positive
 Oii ajith Un movie nalla ella,negative
 i m vijay fan but thala yam masssss,positive
 Iam super star fan please like panuga,positive
 irumugan maathiri irukku          voice aa  sonnaen,positive
 Thala unusual role yuvan come back,positive
 Dialog : க‌ல்வி mattum yaralum nammata eruthu aaduthuka mudiyathu.. Vera lvl,positive
 Thalavia neenga veera level boss and neega thaan marana mass,positive
 Thala  yuvan bgm vera level,positive
 Yarellam kamalvude video song wait pannura:star-struck::star-struck:,neutral
 Karthi thevidiya magane nee ellam edhuku da cinema industry irukka pooi thooku pottu sagalam da intha pollapukku,negative
 STR fans :  Engaluku rawwa padam varum da,neutral
 Adha 38k dislike thayolinga kedacha nalla irukum,negative
 wait and see .. mokka maximum.,positive
 enna da trailer kannapundai madiri iruku,negative
 Sema movie.. yethana murai vendumanaalum pakalam.,positive
 Awesome Thala fan naa maariduvenoonu Bayama irukku,positive
 Vj sethupathi villain role marana mass,positive
 Nadippin nayagan gal.  1st sivaji  2nd kamal  3rd vikram  4th dhanush  5th surya  6th vjs.,positive
 Haters r barking in this cmnt sectionnee yenna vena sollikaaakatharikaaaThala thala taaaaannn,negative
 1:03 style ahh  Solurathu kuda style than Thaliva,positive
 thank you so much Rajini sir,neutral
 Thalaivar ku age 69 na illa 20 ya....,positive
 evolo nal achu indha mari mass dialogue oda padam pathu.. orae bayam suri mattum,neutral
 Ayaz.... kutty moonji.       Proposers,positive
 Makkal selvan fans hit like here....,positive
 Power ranger megazord niyabagam vantha hit like,negative
 Super star na super star tha,positive
 Simran Trisha pattilam iruntha Padam nalla irukkuma,negative
 Namakku thevai aanantha namma thaan adichu pudunga um,positive
 Naa paathadhu avandhana.. illa en kannuku apdi thirinjatha,positive
 Ennada panni vechirukke editor appadiye kadha full a sollivechirekke,negative
 Mass Vjs... Veere veere level,positive
 Intha deepavali Thala fans kuda kondadaporaga,negative
 Viswasam : if you are bad  Petta : iam your dad verithanam,positive
 Shakthiman fans kill the like button,positive
 Neenga adichu norukunga thalaivaa chiyaan rocks,positive
 Soon 1M Likes  Before Movie Release Kandippa Vantudum,positive
 Ra ra ra ra rajini Tha tha tha thalaiva  Su su su superstar,positive
" 261,636 views\r ! in 10 minutes....",neutral
 Ellam avan setal concept maari iruku...,negative
 Daivu seidhu. ....asuran...koodamattum... release pannatheenga...apparam...panam...poachu..na... Onnum...sollamudiyaathu,positive
 Thalaivar marana mass I am waiting petta,positive
 Andra Pradesh Ajith fans like here,positive
 Verithanam Overloaded  Nee vaa Thalaivaa  DFC eppavum un kuda irrupom,positive
 ivanuku nadikave varathu...intha padam oduna mathiri than...enpandringa...build up kuduthu kuduthe onnum illama aakidunga...,positive
 Haha yen da avenger music varuthu,positive
 Maranam Massu maranam Athukku Thala Tha Poranthu Varanum; I Love You Thala,positive
 Dhanush + vetrimaran....vera inna venum padam blockbusternu solrathuku.....Asuran,positive
 True Thala fans like here,positive
 Kappan veda  VARA LEVEL movie da Indian Bruce Lee dhanush Anna,positive
 I see this movie I like,positive
 Die HEARTfan of VikramSir ...  FROM Tollywood ....,positive
 Anyone after sangatamihan flop like her,negative
 Oruthar mela neenga viswasatha kaatrathukku inoruthara yen asinga patuthuringa,neutral
 padam mokkaiya aga pothu nu nallavea theriyuthu,negative
 Rajinikanth  sir  semma looking  ah,positive
 DHANUSH FANS -----  LIKE HATERS OF DHANUSH ------------ COMMENT         ANY WAY BLOCKBUSTER FILM OF 2019 ASURAN,positive
 adra sakka... thalaivaa ... marana mass.. adi thool.... Petta Pongal...... Petta Parrakk.....,neutral
 Thalivaaa nee vera level  padam parakum,positive
 Vijay sethu pathi Telugu fans .. Hit like,neutral
" Most like pottavanalam namma சொட்டபதி பேன்ஸ்  than ,",negative
 Aiiiyoooo semma da.etha trailer pakka avalo nal waiting...,neutral
 Last dialogue ellarum kettingala trailer ah full ah parunga semma dialogue,positive
 15times Mela pathanka like me m,positive
 I miss you ishwarya rai madam,neutral
 Talaivar sim super..bt intha movie trailer etir parta alavu I'lle. Anirud music simple oni..follow Michael Jackson music..talaivar taniya vandale super,positive
 Marana mass  DHANUSH  ANNA   adutta  award   waiting,positive
 Seththalum sanda pottu saganum kaal la vilundhu saaga koodathu ahimsaya pathi yaarachum pesuna naan athigama use panra dailogue ithu,positive
 petta parak... Kola Kandula iruken. Thalaiva redefined,positive
 Vikram fans from Karnataka? like maadi,positive
 VS annan eppothum semma Love from kerala,positive
 Thaliva SEMMA mass super star summa alle viduthe,positive
 it's look like power rangers SPD,negative
 Trailer bakwas hae pr movie lajawab hogi. Akki Sir & Rajni Sir,positive
 18k dislike pple hang yourself Teaser is mind blowing 80s Rajini sir is back,positive
 ungalukku vayase agala sitty love u ma,positive
 Rdj vanthu Sethupathi padathuku dubbing pananum. ENDGAME SABAM..UNGALA SUMAVIDATHU. IRON MAN VOICE,negative
 R A J A Y U V A N,positive
 Todaycininews youtube channela marakama subscribe pannirunka,positive
 Best makeup (getup) for rajini after Shivaji film!!,positive
 Crime side movie am love it.RATCHASAN mathiri irukkunumnu aasapadraah...,positive
 Shankar sir we want anniyan 2,negative
 THALA ya paakka Kaalaila ye vantomla,positive
 Just for fun  Kk naaa yarru  Kanja karupu,negative
 vere level... katta waiting for THALAIVAR166,positive
 Last dialogue semma  karthi Anna .... Nala panirukenga ....,negative
 Trailor summa pattiaya kilaputhu.. Vidala pasanga ellam  ippa arasiyal aasai vantha mothala Super star aa maranum..,positive
 Rajini sir u vera level hero.... Iam vijay fan but... I like ur mass acting..,positive
 Mathavanga mari bandha katti nadikama karthulla padam choose panni nadikirau love u thala hats off,positive
 No one two la papanga vilayattu SUPER STAR,neutral
 intha padam Block buster agumnu solldravanga oru like it,positive
 Ippadi naraya naraya naraya naraya narayaaaa.... Vera level THALA,positive
 Thalada Thalaya Minja Tamil Naatla Veara Ewanda :thinking_face:??????????,positive
 ennada 3naalku aprm trending..... enna pithalaatamaa iruku......,positive
 Enna solrathu marana Witting kadaram kondan chiyan Anna aaaaa,positive
 Ketta paiyan sir intha Kaali,positive
 Dislikes epadi da pandringa.karthi ku kudava haters irukinga,neutral
" vera level thala, en channel ku oru sub podunga thala veriyarkala, ungaluku kodi nandrigal",neutral
 26k dislikers  better consult doctor,positive
 thoothukudi thala fans ellaarum oru like podunga,positive
 Padam super duper hit nu soldravanga yaaraavathu irrukingalaa paah...??? :smiling_face_with_open_hands::smiling_face_with_open_hands::smiling_face_with_open_hands:,positive
 Chiyaan ku all the best..but trailor semma mokkkaa..,positive
 Thalaaa maranaaa masssss love u thalaaaa,positive
 Wwoww.... 1.38 scene kaangga ve poiye padam pakanum......... pakka massss,positive
 super   Asuran Trailer mass mass,positive
 Dislike potavanga nalaiku kalaila trending la parunga ... With Respect from Ak fan...,positive
 Hollywood padam paakaravaga endha padadha impress pannadhu ninaikukiraen,positive
 Entha kaliyoda attatha pakka than Porinka Pongalukku,positive
 Entha naaaida VSP ananuku dis like pannathu kaila kedachinga mavana kollama vidamataaa (i will prey god for blockbuster sangatamizhan,negative
 Pande TV layum super ah nadipinga movie layum nalla nadichurukinga,positive
 Kola kandula irrukam veral level mass thalaiva,negative
" Remake veara level Thala, U1, H.V",positive
 Orutharu mela visvasam katurathukaga innoruthara athuku asinga patithirunga semmmma vera level,positive
 Ayyo yepdida ipdilam yappa marana mass da sama veriya iruken nalla thramana sirappana padam paka,negative
 Rekka mathiri illa tha irutha k,neutral
 Shankar sir avenger trailer patha pola irukku Hollywood rangekku irukku superoooo super sir varthaye Illa Vera Level sir,positive
 Stlye king Thalaivrrrrr back Diologue elam semma...rajini veriyanukana padammmmm,positive
 Mass good work    keep on rocking SUPERSTAR 2.0,positive
 mee stail Avariki radu  sir  meeru supar star  no1 Hero,positive
 Kadaisiya marana mass Panna porathu enga ANNAN VIJAYSETHUPATHI thaan,positive
 Thala  oda lawyer acting ah pakka waiting ya..,positive
" Ippa inda SKfan ta enna solla poringa , commenters",positive
 Indha manusanuku oru nallathu nadakanumnu ninaikuruvanga like podunga,positive
 Now rajni sir fans be like 2:18,neutral
 yov poya ethanai Thadava than paakurathu ... Vera vela seiya vida maaturaru intha Aalu,negative
 Vera level la iruku!!! VFX is awesome....,positive
 but i want karikalachozhan also,positive
 Pongalku Petta parrak Sure Petaa gon be enjoyed by fans Ullalllaa song maranamAss,positive
 Paeru DHANUSH'u! National award winner DHANUSH'u! Kaelvi patrukeengala! Verithanamaa waiting for ASURAN,positive
 776k :rolling_on_the_floor_laughing::rolling_on_the_floor_laughing::rolling_on_the_floor_laughing::rolling_on_the_floor_laughing::rolling_on_the_floor_laughing::rolling_on_the_floor_laughing::rolling_on_the_floor_laughing::rolling_on_the_floor_laughing::rolling_on_the_floor_laughing::rolling_on_the_floor_laughing:Adeiii.. Neegalaahda.....  Yeani vacha kooda ettadhu pola.. Thalapathy records ah:rolling_on_the_floor_laughing::rolling_on_the_floor_laughing:,positive
 Dislike podradhuke YouTube pakam vandha thalapthy fans like aa podu,positive
 Yena thala Vera level La pani erukeynga luv u soo muchthala,positive
 Paaka porom  Kali today aatatha,positive
 Wow. I love you Thalaivaaaaaa.,positive
" Karthik amazing , thalaiver Rajini so young look semma Pongal Marana mass than:smiling_face_with_open_hands:",positive
" Izukku meella wait panna mudiyala, Thalaaaaaaaaaaaaaaaaaaaaaaaaaaaa",positive
 Iam enjoying..... Movie pakka block buster ..love you super star rajni sir from ANDHRA PRADESH super  Mahesh fan's,neutral
" omg, Indian filmmaking is so embarassing xD",positive
 1:53fight scene kola mass vera level,neutral
 Original - Pink Remake - Nerkonda Paarvai But Ajith Kumar acting is Killer,positive
 Looking Like Hindi Movie Pink Remake   Like Ajith Comment Vijay,positive
 Woww Rajini garu  Rajiji fans hit like,negative
 Palaiya Rajinj ya patha mari irruku....Padam vetri pera valthukal,positive
 Kole gandle irke mavane  Kollame vidamate:nerd_face:,neutral
 Knjam body maintain panna...inum nalla iruparu...,neutral
 Intha Super Star thaaan engaluku venum  90's kids fav,positive
 Padam vera level la irukkum pola.... Conform 250 crores box office,positive
 December 20 semmaiya iruka podhu SK Anna Vera level Vara poraru,positive
 Ithayellam epdi da dislike panna manasu varuthu ungalukku,positive
 Trailer pathu veri aetha varavanga yaravathu..??!! Waitinggg,positive
 Vetrimaaran dhanush deam vera leval,positive
" Telugu Sri Maha Lakshmi (srihari hero) movie , remake",negative
 Semma semma super super super super Thala Mass,neutral
 Mokka traileru itha poi nalla padamnu solringa ponga sir,negative
 Sinthanai &silai udaippu. Ltte  leader piraba Karan ah bro,positive
 End ley dialogue purinjitha appo sandaiya neeruthunga da pakkigala,positive
 Thaliva..nee thokka matta thalaiva thairiyama sanda podu,neutral
 Oruthar mela irukura visuvasathuku innoruthara yen asinga paduthiringa i think intha dialogue ellam fans kum suit agum,positive
 School pasanga 6 maniku vanthu dislike poda arampuchutanunga,neutral
 Thala naa Mass  Thala naa Class,positive
 Wow.... Thalaivar semma smart.... Palaya Rajinikanth... Semma,positive
 He is looking like a 40 age person. Unbelievable,positive
 Guys lets make it to 300k likes,positive
 Thalapanna yarukum thakuthi kidaiyathu mind it,positive
 Dhanus acting Sollamuiyala asura very manusan eppadi ippadiyallam   semma,positive
 No 1 trending in SG & Sri Lanka still,positive
 Paka thana pora Inda kaliy to atatha,positive
 Mega sod power renger vfx looks like cartoons,negative
 Ena pa ipdi iruku Vera level..,positive
 Evalo vatti pathalum puthusave irukku(ethare thavana kandalum puthiyathu pole und),positive
 1 million likes varum solravangala  Like panunga,positive
 Film making level at it's peak  Shankar,neutral
 Talaa ajith sir wt a style,positive
 Padathula Vara dialogue Yara pathi pesuraga endrathu mukkiyam i'lla yaru pesuraga  endrathu than mukiyam,positive
 thalavaaaaaaa u superr vera vera level thala,positive
 Telugu Thailavar fans hit like button superstar,positive
" O my God superstar Rajinikanth, navajuddin siddiki, vijay setupati , what else needed",positive
 Vaalum theivam ajith Kumar Manitha kadavul ajith Kumar Sokka thangam ajith Kumar En uyirai kaakum ajith Kumar Ulaga uthaman ajith Kumar...,positive
 Thilavaaaaaaaaaa.......,positive
 25 k dislikes ethuku da intha trailerku poi apdi ungalukku entha trailer tha pidikum,negative
 Like....danush Comments ....surya Yaru mass nu parkalam. Iam danush,positive
 Petta block boster movie in telugu Telugu fans like,positive
 Ethulaa over yaa 22 age yenakku oru love eilla aana 80 vayasu ullava love pannuraaga mudiyala,positive
 Thalaivar semma style marana mass adichi underwear oda odda vituduven,negative
 മലയാളികൾ ഉണ്ടോ karthi kerala fans like adi,negative
 Hollywood kaaranalatha mudiyumnu illa tamilanaalayum mudiyum da example shankar sir,positive
 50 times watch panavan like podu,positive
 Enna da bomma padam Madhiri iruku,positive
 kilavan aijth look as 80 age old man,negative
 collegla erundhu pakarvangum matum enga like panunga marana maas petta.....,positive
 Bgm vera mathiri irrukku yuvan vera level LA pannirukaru,positive
 Wow wow wow wow wow,positive
" Oruthar mele neengge viswasam kaatradhukaaga, innoruthare yen asingga padutharingge? Mass thala nee!!",neutral
 Vera mathurii irukuuuu thalaivaaa..... Ni vah thalaivaaa vera Level expectations,positive
 Verithanam kaithi vs bigil kandippa rendum Blockbuster hit,neutral
 Ithu Trailer thaana illa vera yathachumaaa  ipdi iruku  saamy,positive
 Thala thala pesunaa anilu ammaiyan vjmaaa Ku tharama sembavam irrukku daaaa anilu Vick sorry kotte pathy,positive
 Hahaha last dialogue with malaysian language,negative
 Evalo vaatti paarthalum 11M views mela earamatinga they,positive
 I Am Thälâ  Fan Support iN VikRaM siR,positive
 Thalaivar asuran ah vanthurukaru...Last la bgm vera levell,positive
 Wishes from Kumari sk Anna fans,positive
 Indha Diwali peria Sambavam pannum pola Kaithi Karthi attitude,positive
 Movie parthu tu  vanthu trailer parthu rasichukittu irukean,positive
 Pandey thalaya vey ethirthu pesuriya goyala theatre pakkam varuva la va.......,positive
" 1:29 inadhu today kula jithu savanuma!    Vijay sethupathi , andha mari naka kodathu",neutral
 ena patamo ethala poiyarunga paappa . ajith fans mattuntha poi pakkanum.,positive
 Daily pathalum konjam kooda bore adikkala,positive
" Padam paathathaa puriyum ana thala thala thaan pa,",positive
 Semma thalavaaa full,positive
 Mass mass mass mass mass mass mass masssss,neutral
 Yenda mask kuda krishn padatha pathu  copy adicirukigaleda,positive
 Inda Padam sure oru kalakalappu... Happy and waiting for release,positive
 Bgm sounds like Va modhi paru theme from Nerkonda paarvai..,positive
 When Pandey gets up  Vandumurugan : IM SPEAKING.. NO CROSS SPEAKING... SITTT DOWNNN,negative
 I hate v... s...  Iron man kill it v... s,negative
 ok thala enume yaraium oggalukaga asiga padutha matom,positive
 Appaadi final a trend aachuPETTA PARAAK,positive
 Ipadi neraiya neraiya neraiya ......................Thala eyes.... Wow...,positive
 Thala sonna kadaisi doiluge athu thala fanuke sonna mathiri iruku sema .....,positive
 Dailyum trailer ah thirumba thirumba paakuravanga like pannunga,neutral
 Nadigar Ajith I kaanaa.... We are waiting...,positive
 Bgm vere levelnu solravanga lika podungaya,positive
 Thalaivaaaaa ur great.. By Vijay fan,positive
 Niraya Niraya Niraya.......   Sema,positive
 Kutti moonji vivek intha movie la irukaaraa illa enakku mattum trailer la irukkura maathiri thonuthaa,positive
 801k likes athuvum remake movie ku Mass,positive
 Maranam...massu maranam.toughu tharanaum...adhuku avan dhaan porandhu varum....semma thalaivaa,positive
 Thoongi Enthiracha vudane evlo million views nu paka vanthavanga like podunga....,positive
 1 million likes vara matignkitheeee so sad,negative
 Thala innum konjam naal la thatta va var mariduvaru,positive
 Nalla irukku pa hit aayidum pa,neutral
 Modhala dhuruva natchathiram udunga da dei,positive
 Trailer marana mass nu solravanga like pannunga,positive
 Vithule soru ilena paravale.pilenge school padikathiyum paravale..ana..actor pi 2 manggu vangi tinnulenah pundengeleke thukomo savo varathu phuikkk,neutral
 Trailer uha pakkamale like podum sangatha serthavan,negative
 Last dialogue is a hint to his fans... Thala mela visvasam kaatrathuku thalapathy ya asinga padutha koodathu,positive
 Hindi dubbed main kab aayega trailer,positive
 Marana mass na adhu naanga thanda AK Brothers,positive
 Trailer looks like rekka & junga. Expecting more from makkal selvan...,negative
 Mr.Vandu Court la ipdilam kaththa kudathu...,negative
" Yarulam intha trailer pakuringalo, oru like pottu pongapa... Thala vera level..",positive
 Ennada nadakuthu.. Inga.. Onnum puriyala.. But semaya iruku,neutral
 VIP KAZHINJU ADUTHATHU.. ENNI ORU AWARDUM,positive
 Keela avlo Peru irunthum epdi da mela vantha...  VJS: Atha keela irukavanta kelu da,neutral
 Amitav  baccan  movie remake,positive
 Engaluku intha Padam la vena...Dhuruvanatchathiram movie mattum epdiyachum release pannirunga...3 yrs ah antha movie ku thaan waiting..,positive
" Neraya perr enga SK anna ku movie choose panna therilai nu solluvanga,  avangaluku idhu serrupadiiiiii",neutral
 Last walking moment mass ah iruku,positive
 Akshay Kumar role ah sivakumar rukku kuduthurukalam,neutral
 2.0 waiting veriyans like  here,negative
 Thala  kola mass,positive
 Pongalukku paraak .....the 90`s Rajini Back........sirappana tharamaana sambavangala pongalukku paappa......,positive
" Double Agent,  C Vik &  ലെന",positive
 Thalaivaaaaaaa.......  Ungaluku vayase aaakathu. Nee mattum thaa Thlaiva mass. Massuke Boss.,positive
 Sk U1 Fans like hit,neutral
 Sweet sapda poromnu unga kelavan sonnan paarthu sugar vanthu sethuraama,negative
 Kaathu kiliyuthu da....yeppaaaaa......trailer ke ipadiya...main picture la Theatre ae nadungum,positive
 Appadilam nadakathu .nadaka kudathuThala vera level,neutral
 oh my God akhsay sir super,positive
 Phill mokka kaithi super aollravanga like podunga,negative
 Mmmm 1000 times this video see,positive
 Rajni sir +akki =storm blockbuster movie,negative
 overa iruku and editing illa konjam speed illama iruku,neutral
 Earphone la U1 Bgm kekum pothu Vera level,positive
 Comments parka vandha padika vandha nanba nanbigal like pannitu pooga,positive
 Ena da apo apo viswasam theme varudhu,negative
