sentence,label
 Thaliva vjs epoma mass vilan netha pa say like it,positive
 Intha padathukku askar award kekkuravanga like podunga,positive
 THALA POLA VARUMA DAA KOOTHIPATHY VIJAY FANS,negative
 Onnum purila last fight mattum paravala,positive
 Karthi sirto my kadavur village... Tq sir ..,positive
 Ethana Peru chitti reloaded scene kaga marupadiyum pathinga...,positive
 always super star ma rajini sir,positive
 Verithanam  savuratha irundha sanda potu savanum ithaaaaa Kola mass,positive
 Looks like remake of pink movie,positive
 Fdfs viewers hit  a like..,neutral
 Mass da...  nama thalaa...,positive
 Bhigil pans.....Kaithi sunniya pudichi umbunge da,negative
 Siva kita  inime padam koodukathinga....,neutral
 So ARYA dha mass  Magamuni acting > dhanush ...,neutral
 Remakena vera copyna vera enna puriyutha.inthamari mosamana varthaigalai potu pesaringale arivilla. Hai ajith fans neenga inthamari pesathenga,negative
 Tamilrockers la paatha verithanam ah irukum pola,positive
 Rajni sir fan like here,positive
 Yuvan bgm kola mass thalaiva marana waiting for valimai,positive
 Love you THALA eppavume mass THALA,positive
 Ippo dhaan yaa korean padam maari seriya eduthu irukinga,positive
 Verithanathuku maru peyar thalaivar Hit Like Thalaivar Verians,positive
 Sathiyama nalla ila ipo lam pasanga neraiya hollywood padamlam pathutu irukanga idhu ellarukum pudikuma konjam sandhegam dhan,positive
 RajiniNeutral fans like.,neutral
 @0:36 to 39 vaa thalaivaa nee,positive
 Mass Sethu  Anna Telugu release plz,neutral
 200 times ku mela pathavanga like here,positive
" pink trailer minjum namba Thala NKP trailer,  pl support my channel, periya like podunga namba thalaiku",positive
 Ivaruku Intha vaisula agathu pola... Omg wattta a man thalivaaaaaaa,positive
 It's gonna be PettaViswasam Pongal,positive
 Chiyan Vikram Sir vera level  (BY) Tirunelveli pasanga,positive
 Vaa thalaiva via diwali mass ur movie bikil  out,positive
 makkalselvanfans Sir like here :love-you_gesture: I am from Telangana @hyd,neutral
 Angeee ellam viswasam trailer parthaaa nambee ingee petta parpomm...,neutral
 Thalaivar enaikumeee masss tha pa meaning of style,positive
 2020 Fulla un thiruvizha tha dhaunsh Anna,positive
 Padamna Ithu padam ....Semma message movie ....Great,positive
" vada Chennai la irrunthu, etho oru village poi irrukku Kathai Kalam",neutral
 Sollitivara  puyal illa enga thala sollamavara sunami,positive
 Innu 900 k likes kooda varalla  :rolling_on_the_floor_laughing: Ajith fans ellavanu mbunga Oomba readyabelow,neutral
 2.23 thalaiva unnoda indha step ka ga vea nan FDFS,positive
 I don't like rajini...but trailer weightuu..,positive
 Daii pink padathula fighta varathu AJITH DOES NOT SUIT AMITA BACHAAN,neutral
 Ayiooooooo vera vera vera vera mathiri,positive
 Visvasam trailer trailer sppourt panavange yalaru edhuku pannuge,positive
 Paaaa Goosebumps... Such a heavy voice..,positive
 Kommala ithuku vada Chennai paravala da dai verithanam da,negative
 antha KadaiSii waarTTha ungaloda Vishwasattha KaaTTa MaTThavangala Ean asinga padutthriNga...,positive
 Yar ellam vaanillrul NKP first single  Update apram trailer pakka vandhu irukinga,positive
 Thala samma thala last sonna vusayam,positive
 Summa thala thalanu vanthurveenga thalapathy film paarunga,positive
 Wooosemma maas maaasss marana masss waiting thalaivaaa baba rajini,positive
 Iraivi mercury lam kan munnadi vanthuta poguthu,negative
 Vandhuten nu sollu thirumbi vandhutennu adhe styleoda thirumbi vandhuten nu sollu,positive
 90s rajini fans ...... hit like,positive
 Pink movie vs nerkonda paarvai movie???,neutral
 Dec 2017 - VELAIKKARAN... Dec 2018 - KANAA... Dec 2019 - HERO ...,positive
 Thala yoda kusu va kudinga daa...avan vaithayalaya nakkunga daa chunni chappigala!,negative
 Thala vera vera vera level :smiling_face_with_hearts::smiling_face_with_hearts::smiling_face_with_hearts::smiling_face_with_hearts::smiling_face_with_hearts:,positive
 Chiyaan sir vera 11 mass ahh irukuu paaka trailer Hollywood trailer,positive
 Dhanush & Manju varier Combo..,positive
 Views 56k ku kattuthu like 102 k ku kattuthu,neutral
 Intha like intha views pathadhu ininum niraiyaa niraiyaa.......,positive
 Oruthar mela neenga viswasam kaatradhu kaaga innoruthara yen asinga paduthirunga,positive
 Color grading superb ruben bro vera level,neutral
 Dhanush acting verithanam nu soldravanga like panunga,positive
 Thala pola varuma  Thala eppavume mass Vera level,positive
 Kaasa micham panna paatha  Sathiyama music nalla irukkadhu,positive
 Thala pola varuma  ULTIMATE STAR,positive
aah paakka vantha vanga hit like,positive
 Superb thala frm pavan Kalyan fans,positive
 Am waiting... For thala in Nerkonda parvai...,positive
 Not bad........... Any way karthik flop agama.. Iruka...... வாழ்த்துக்கள்,neutral
 Epavume ajith oda own dialogue padathula pota padam flop tha...paapom director sona mari nadichurukara ila ivarukaga kadhaiya mathirukangala nu...,neutral
 Iam waiting Chinna Thala Vijay Sethupathi movie,neutral
 Eppaa dai unmaiyna courtukku veeduma alainjavanttea poi kealunga judge munnadi eppadi pesuvanganndu therium,positive
 Vijay Anna rasiganin manamarndha valthukal to ajith. Sir,positive
 Phoenix Thala in NKPku marana waiting  Agust 10 therika vuduranda,neutral
 Enna mairu da panraem fans likes yethungada,positive
 Thalaiva vaa thalaiva get rajinified semma wow,positive
 10 times mela pathavanga mattum like it,negative
 Viswasam Teaser vartum Nama Side la Irnthu Oru Sambavam Panuvom,positive
 Pink remake. Thala ipadi awareness movie la nadikarathu happy.,positive
 Acting verithanam nu solravanga like panunga,positive
 After a long time Thalaivar look...yeppaa...semmaaa...  Vere leaveldialoge vere leavel  anirudh bgm vijaysethupathi..mass total.. petta.... kola mass...doiii...,negative
 Superb next surprise.... cinematography romba nala iruku,positive
 Thalaivaaa Sure BB :star-struck: Eduthu vainga da national award ah,positive
 Trailer laiyae story purinjikittavanga like pannunga,neutral
 Last dialog unga fans ku solunga thala,positive
 Yuvan Shankar Raja music vera level,positive
 Thalaiva neenga vera level semma cute,positive
 Awesome Shankar sir...its standard like  Hollywood movie...superb.,positive
 othaaaaa maranama daaa yeppaaaaaaa veraaaa level yaaaa Namma_diwali_kaithii,negative
 3 min a 300k views omg !!!,neutral
 Climax  Heavy maranna mass seen seens............,negative
 But still vadivelu is the best hostel warden ever :),positive
 90 s kids love  vijaysethupathi,positive
 Kadu iruntha eduthukuvanunga... Kasu iruntha pudigikiduvanunga ... Padipai mattum eduthukave mudiyathu.... sema dialogue...itha  Feel pantravanga like panunga,positive
 Hit Like if u are waiting for kaappaan.,positive
 Thala na mass. Thala mattum thaaan Masssssssss,positive
 Ennagada 81k views 97k likes,neutral
 suyama sindhika therinja ellaruma HERO dan,positive
 Pakarathuku Chinna paiyan maathiriya ???? poi sonnalum oru nayam venamada !!!,negative
 Nadikrathukunu vanthta nadikanum ...enniya ithu ... old thala,positive
 Paa semma shankar sir neenga than bestu kollywood illa,positive
 Varaa porendaa THALA MASS MAGIC SUPER STAR AJITH Kumar,positive
 Bgm like nkp theme va modhiparu:thinking_face::thinking_face:,negative
 Ye to mere ko pink se bhi better lag rhi h Better dialogue Masala,positive
 Appo Kabalieee... Na Nerupuda  Eppo robot na chitti 2.O version,positive
 Different role and different look thalaaaaaaaa,positive
 Bigil Vida kaithi Sema solravanga like podunga....,neutral
 Pondatti pulla kutti sentiment irundha appadiye odiru mavane kola gandula iruke,neutral
 Vikram Veriyarkal LIKE BUTTON Therika vidungal,positive
 Yebbah Dei ... Nalla Padatha Keduthutingale da ... Go and Watch Pink,positive
 inga kodutha sweet saapttu andha pakkam poanaen araliya arachi kodukkuraanunga.. yammaadi dei siva aendaa indha kola veri,neutral
" Naaku eebhasa teleidu, Vikram sir old looks is awesome and his intro style",positive
 Dei vengigala oru trailer kuda oluga eduka mudiyatha,positive
 Pongal ke confirm sweet sapada porum,positive
 Dai siva nee enna bat man aaa,positive
 Omg omg omg I just loving thalaivar get up and dialogues. Marana masssss,positive
 idhala nanga bhairavaaa layae pannitto da dai pongada,negative
 Yarellam kadarm kondan movie paththu enga vandurukiga‍‍‍,positive
 Ajith sir :star-struck:   T H A L A,positive
 Thalaivaaaaaaaaaaaaaaaaaaaaaaaaaaa  mavane kollama vida maaten,positive
 thala thala thala thala screen ku marana waiting,positive
 Ommalaaaa vangada eppo....ethu unmayave thalaivar pongal daa mavane...gethu,negative
 2:11 semma smile   sweet sapada poroum pongal ku,positive
 Mount Hermon  Darjeeling ...  superstar Rajni,positive
 Hoo hoooo .... majha agayaaaa dill irnda yarawad koda release pannangda papoon ...,positive
 Dhaush Nadipuku Intha padam Theeni podum nu ninaikuren,positive
 It's looks like Ramayya vastavayya telugu movie :thinking_face::thinking_face::thinking_face::thinking_face::thinking_face::thinking_face::thinking_face::thinking_face::thinking_face:,neutral
 Thalivaaaaaaaaa neeee semma i love u soo muchmake way for the king,neutral
 Trailer bangam youv shankar yepaya ni ippadi oru padam rajini vechi yeduka pora yepapar robo gobo ni poya,positive
 Powar bank of..  All Bollywood budhaa khans..,positive
 Dai kadaseela indha alaiyum massu engra perula kaaa koo aakiteengala,negative
 Viswasam pesama post pannidunga.. illati kaali dha!,positive
 Verithana ma irrukku pa trailer pakkum pothey,positive
 Athey vintage nakkal la varanum,positive
 മലയാളി ഉണ്ടോ ഇവിടെ Namakku thevayanatha namma than adichu vaankanum,positive
 Rajini oda DNA va save panni veinga pa. ivaru madhri innoruthar vara maataru,negative
 Omg sooo smart... gethu thalaaaa marana masssss,positive
 blood ta   thodakkira scene   semma,positive
 1.18 la title than iruku..sela payaluga summa suthuranunga.. trailer,positive
 VIJAY SETHUPATI CAN NAIL ANY CHARACTER GIVEN TO HIM ..,positive
 Potta thevidiya pasaga .. punda Vijay thayoli mavan :rolling_on_the_floor_laughing:,neutral
" U1,innum neraya, neraya, neraya,neraya, neraya, neraya iruku.:smiling_face_with_open_hands::smiling_face_with_open_hands::smiling_face_with_open_hands::smiling_face_with_open_hands::smiling_face_with_open_hands::smiling_face_with_open_hands::smiling_face_with_open_hands::smiling_face_with_open_hands::smiling_face_with_open_hands::smiling_face_with_open_hands:",positive
 Super Star Awesome Action Stylish King Rocks. Petta Pongal Da Viswasam Parruppalam Inga Vegathuda.,positive
 82k views  102k likes  Super :star-struck::star-struck::star-struck::star-struck::star-struck:,neutral
 End Fight Vere level,positive
" Thala semma semma , congratulations from kanyakumari Simbu fans",positive
 Thalaiva u r simply superb Indian super star,positive
 Looks like he will SET SCREEN ON FIRE,positive
 Kaun kaun Akshay sir ka fans hain,negative
 Kadasi dialogue super thala ...... Thalapathy veriyan,positive
 teaser to bekaar tha per trailor dekh ke aankhen bahar aa gyi....Mega blockbuster hogi movie,negative
 Ada aamaigala 1m like kooda varlaya aamai Ajith,neutral
 Look like pink hindi movie remake....,neutral
 Very disappointed .....Looks like cartoon movie....,neutral
 Idhu Hollywood madhiri irukunu solravangalan indha cmnt ta like pannunga,positive
 Kaithi diwali  Bigilu poolu nu oorma ponga da palvadi vgay pans,neutral
 Trailer pala thadava parthavanga mattum our like,positive
 Vetrimaran and gv prakash verithanam,positive
 Hero kya naam hai movie ka..,positive
 Dhanush vera level la poita ya ne,positive
 Enaya trailer liyae kadhai a solitinga...,neutral
 Sure blockbuster Congrats from thalapathy fans  Lokesh kanagaraj,neutral
 Thalaivara Nega eppaum AXN stylé movié mátum tha nadíkanúm,positive
 Maranam massu Maranam toughu tharanum.. Adhukku Avan dhaan porandhu varanum,positive
 6.7 M views and  681k likes,positive
 6 days ah srilanka la trending 4 kulla thaan itukku,positive
 Gommala marana kaatu kaatitan trailer la ye,positive
 semmaa trailer Vera level la iruku,positive
 Damn..im a proud. Chiyaan vikram fan..,positive
" Super Vijay Sethupathi  from a Telugu fan, Makkal selvan Da :sign_of_the_horns::sign_of_the_horns:",positive
 Inge vanthu katharum anaithi anilandigalukkum vaitherichal....p*** moditu angutu ponga da bogul bikil...ntu,negative
 Yaruda avanunga vanthu Cinna pulla thanama dislike pannittu irukkaranunga,positive
 Diwali ku tharamana saanbavam pola varattum varattum waiting,positive
 Will it get 1 million likes,negative
 sema ya iruku thala thala than...I love you thala,positive
 Konja naala thamilla sema hit padama varuthu.. Waiting thlaiva... Irumpu thirai Imaikka nodikal Ratsasan Uturn Merkuthodarsimalai 96 Pariyerum perumal Next thalaivar 2.O,positive
 Last la vara andha dance step than ultimate,positive
 Athu epadi da views 50k...likes 91k ... How?,negative
 Epdi dhan vivegam kum visuals la nalla irunduchu padam pochu edhum apdi dhan aaga podhu:rolling_on_the_floor_laughing:,neutral
 Chiyyan vikram fan's from Kerala like here,positive
 Ne vaa thala inga un level ku yarum illa ah,positive
" sema vfx, Shankar sir great",positive
 Thangam nee sonna sari solluti sellam.,positive
 Elam avan jayal movie  remake pa,negative
 Superb thalaiva .... Love you thalaivaaaa......,positive
 Sema Sema Sema Sema Sema Sema Sema Sema Sema Sema Sema,positive
 I'm Vijay fan... But thala mass,positive
 Padam Vere level from Thalaivar veriyan.  Abirami big boss performance seme!!!,positive
 Irumbhuthurai maari indha movie super block buster agumnu solluravanga like here,neutral
 So many many many many..Like போடுங்க,positive
 Eppo thambi 1.4 million likes vanguvinga,positive
 Trailer eh anal parukkudu Film kandippa volcano daaaa,positive
 FINALLY STAR IS BACK WITH SUPER,positive
 1M like varathu pola nalaki kuda sethu,negative
 1.5M views in 60min அம்மோவ்,positive
 Thalapathy 64 Innum masss irukkum nenaikkaravanga like podunga,positive
 Thalaivar Paraaak!! Make way for Superstar,positive
 Lets give a like for Nerkonda Paarvai,positive
 Summa trailer pakaruda vidha silla mutalpoduradhu nalla iruku,positive
 akshay kumar as shiva kumar,positive
panitey erunga vara apalam thala fans,positive
 Comments pakka vandha nanba nanbi gal like pannitu pooga   Trailar supper,negative
 Dai 600 kodi thevaiya Intha movieku varumaiyil vazum eazakku seru potta.....la. natu munnerum....,negative
 Enga thala ya inum konjo chinna vayasu ah kamichirukalam... bt i luv u thalaaaa forever :smiling_face_with_hearts:...,positive
 Mass Ajith Anna    luv u,positive
 Sweet super star rajinikanth  Masssssssss.thalavar masssssssss,neutral
 Semma bigilugu kojam prblm vatrum poola,positive
 Graphics sari illa nu solrathukune oru gang suthum parunga,positive
" sema but aniruth music sumara irukku ,,,yuvan best ah oottruparu ,,,",neutral
 Superstar Rajinikanth very very very mass,positive
 1 on trending in sri lanka... nee vaa thala...,positive
 Kaipulla Vijay Twitter la Trending agudhu,positive
 1:45 Ennada bigil food ball studiyam varudhu,positive
 Kotha trailer ah da idhu.Idhu theriyama Enka Thalapathy kooda Indha director sernthutane... Thalapathy image damage panna poran mattum theriyudhu....,neutral
 Oru  nelathukkaga politician um makkalum adichukiradhu dhan main story.... (Like Natpe thunai),neutral
 ivuru ippathaan oru nalla padathula nadikararrunnu nenaikareen...,positive
 Bgm is like kaala poraduvom song,positive
 Thalaiva.. looking good even at 70..semme,positive
 baahubali 1 and 2 lam thookki saaptruchu vfx la,neutral
 Innum konja neram odaadha nu irukku marana mass,positive
 Vera level thala.. Imputtu azhaga irukiyee thala,positive
 dai thala pera sonnalay summa tamil naday athirum daa,positive
 Vera level dhanush anna GV bgm,positive
 Thalivaaa ultiii vera lvl  warm waiting sk masss,neutral
 Kola masss...... Villain chitti is back,positive
 Summa sollakudathu number 1namma rajini sir mathuyhen vanduruisu Marana mass AT&T than tanks young ka na thalaivar,positive
 Atanga Matta illa Diwalikku thalabathi vararnu therinchum Vara illa ithukkune o patathukku Vara,negative
 Ennayya..namma makkal selvan padam trailerkke oru full thalapathy movie paatha alavukk appadiye silirpp kottuth..,positive
" Dhanush anna kazhuthula ruthrasha kotta illa, karuppu kairu mattum irukku, avuroda pasangalukum athey maari kairu kazhuthula iruku",positive
 Sarr  wow  super  super  movie   kartik sar,neutral
 Mavane kola kaand la iruke kollaama vidamate semmaaaaaaaaaa,positive
 ANY VADIVELU VERIYAN LIKE KAITHI VADIVELU VERSION  -,negative
 IdhuKu evlo ticket price irukka pogudho,positive
 Rangaraj pandey interview partutuvandhu trailer pakuravanga likrpannunga,positive
 All you dislikes person's last dialog for you mad people's,neutral
 Pariyerum Perumal Ku award varala but next time indha movie Ku kedaikanum.,positive
 Petta parrraakkk... mass 1990 rajini sir..,positive
 Bro Muga mudii jeeva cameo irukuma ??? :thinking_face:,neutral
 ENPT... Vena... ASURAN... Venum...  Which... One... Like...?,positive
 Ada paavi gala..dis like podrathuku ne varingalada,positive
 Ivan tholla vera thaangala da yeppa,positive
 Singapore m tranding no. 1  Wow,positive
 Ellam sarithan but Vjs padathula irukaranu kekura alavuku trailer iruku,neutral
 Unkitta irukura padippu .. yaarum thiruda mudiyaadhu purinjavan pistha,positive
 Nalla illa na hollywood edhuruparthen,positive
 Thala dialogue vera lvl movie la,positive
 Ennagada 3naal appram ternding lla variga,positive
 Last dialogue  its true.... Thala superb,positive
" Thalaivar thalaivar dhan ya !!!! <3 enna energy, enna maasu.. Mmale kola veri",negative
 Graphics sari illa nu solrathukune oru gang suthum parunga,positive
 Ranjith sunnia vetti ooda vittuvom .. aprom ooka poolu ilama poidum,negative
 Amaa eppa yenna ..panna..poromm ....ahaaaa      ...Sweet ....sapdaa poroomm.......,positive
 Kola kandula irukan mavane kollama vidamatan hit like hera,positive
 2.18 la irunthu redmi note5pro la eduthanga pola,negative
 Malayalam movie chindhamani kolakes copy ajit vest,negative
 Thalapathy fan but badam Vera level ...semmaya iruinchu,positive
 I love thalaivaaaaa Semma marana verar level thalaivaaaaaaaaa,positive
 Vijay fans hit like here ..:),neutral
 Bgm ke indha padatha paakanum pola erukku...,neutral
 Vergin ponnuga ippo 100%Ku ippo 5% irukkuthu thala sema correcta kettingaa,neutral
 Deii Peasmmma Iruka bigil ku tickets illana pakalam illana tamil rocker thaa,neutral
 Super  thala massss mass  massss,positive
 Ellam ok intha mugamoodi mathiri irukathunu ninaikiren,positive
 Dhanush vatri maraan fans like it,positive
 Suyama sinthika therinjavan than MANITHAN. .....super hero illa sk. Ni seekrama  anchoring ku again vara pora..,negative
 intha mokka hero ku.  action king ah..... ayyo  enna kodumai sir........... hero nu title vere,negative
 Neraya neraya neraya... ... V era level...thala,positive
" sema but aniruth music sumara irukku ,,,yuvan best ah oottruparu ,,,",neutral
 Anil kunjis fans tha dislike podum,negative
 Morning wake up trailer pakka vanthavanga like potunga,positive
 Thalai ku thalai poora Neraiya Neraiya Neraiya romdha Neraiya neracha mudi irruku,negative
 Naanum super man aagelaanu iruke pah..,positive
 You see view 102k but Likes 150k,neutral
 Niraiya Niraiya kevalama iruku intha dialogue.,negative
 1:16 waiting to see tee jay in big screen,positive
 Siva career la best hit idhudhaan solluravunga like pannunga,neutral
 enuku visuvasam padatha pathatha parithavama iruku..,negative
 Thalaivaaaaaaaaaaaaaaaaaaaaaaaaaaaaa   No words can describe ur enthusiasm simply vera level,positive
 Maranam maasu maranam... Toughuu taranumm.... Athukku avanthan porandhu varanum....,positive
 Thala vera level thala &semma,positive
 Ajith ku Mass Kammi a irka 1st Trailer pa.. Bt Thala Top,positive
 Hindi Rajni fans hit like,positive
 Thalaaa thalaaa thalaaa ne vaaa thaaaa,neutral
 tiger  is back  wadakam rajnikant ana,positive
 Police karan kudumbatha govt pathukum unoda pillaya yaru na pathupaKaithi intense trailer sure BB &@Bigil,neutral
 Ippotha magamuni paathu oru kalathule irukke athukulo innona.,neutral
 Anna ne vera vera vera level na,positive
 If anyone saw teejay in it....,positive
 YOUTUBE: IAM hanging on thala trailer PEOPLE: ethu Ku thaa nanga soinum thala fans keta venanuu:star-struck::star-struck::star-struck::rolling_on_the_floor_laughing::rolling_on_the_floor_laughing::rolling_on_the_floor_laughing::rolling_on_the_floor_laughing:,positive
 Wow semmaya iruku sk anna fans hit,positive
 Vayasanalum ivaru alagum stylum innum koraiyave illa,positive
" REMAKE OF PINK, A CLASS MOVIE.",positive
 dislike potavanlam..... Setthuru..... summava Bigil team late release ku paechu vaarthai nadathinaanga... Trailer therkidhu.. Sure shot saravedi,negative
" I'm sk fan but vjs rombhaaaaaaaaaaaa ptikum anaaaaaaaaaaaaaaaaa ,acting Vera level",positive
 780k likes Waiting for 1 Million like,positive
 Why virkam movies not releasing in hindi?,positive
 Gethu kattanu atha thala mattu tha kattanu,positive
 Thala ajith look like indiancinema Logan hughjackman,positive
 Breaked sarkar views in 5 hrs,positive
 Summa Kili  Sk anna tharu maru mass moviekki verithanam,neutral
 Thala endru sollada thalai nimirndhu nillada .. vanthudaruda en Thala ippa vangada kena.................,positive
 Gommala Thala da. Verithanam,negative
 Sarkar cannot beat 2.0 hahahahaha Always Thalaiva superstar rajinikanth,positive
 I m so happy to say vikram fan...shivaji - kamal - Vikram...,positive
 tom and jerry ethinna kallum kollam...,negative
 Ini Paarunga Two Weeks Munnadi Teaser Release Date Announce Paniruvanga Aparam Evanavathu Naanga Record Breake Panitomnu Varatum Avanukalluku Irukku,neutral
 OruthaR mela Neenga Visvasam kaatrathukaaga:face_with_monocle:  Inorthara yen neenga asingapaduthringa   Thala,positive
 Eppa idhu koala maasss....Vijay mattum kanagavel direction la panara ninaichaavae aarvama iruuku...,neutral
 Vijay sethupathi anna semma mass unga voiceku na adimy bro melum ungaludaya movie vettriyadiya valthukkal,positive
 Pink Trailer kuda appidiye copy pannitenka,positive
 1M likes pannanum  Yellarum Ella account um use Pani like podunga,positive
 Pakkaa Mass.. Rajni and Akshay sema mirattal..,negative
 Next year  varikum  wait panamudiyathu for 90s kids,positive
 Old dhanush get up vera level...,positive
 Enada thalaivan VJS oru thadava tha kaatirukinga  Avara paaka thanada mukka vaasi per padathuku povo,positive
 idule velagudu 64 epudi endu best camera man,positive
 Yuvan bgm vere level . pink lam konjom thooram thalli nikkanum.,positive
 THALAPATHI  First  Look  varattum,positive
 Yella dialogue um paakum pothu open ah challenge vidura maathiri theriyuthe viswasam movie ku. Yaarukkellam appudi doubt irukku,positive
 19.2k views to 12M  ......,neutral
 Enna appa rangasthalam remake ha irukum pola,negative
 Kolai gandula iruken kollama vida maten......wat a mass n stylish man yar....,positive
 என்ன ஒரு நடிப்பு....  he s always best in his way,positive
 Oruthar mela neenga visuvasam katrathukaga inoruthara yen asinga paduthuringa ...dialogue nice,positive
 Oruthavanga mela viswasam kaatradhukaaga en innoruthora asinga paduthuringa?! Thala,positive
" Enna da innum, 1million like kuda varala",positive
 Bigil thalapathy da  ...........             aamaiyan gala,positive
 Ethu vera vera vera vera  level trilore,positive
 Super Thala  Suriya Anna fans support Thalaiku Eppovom irukum,positive
 Oruthar mela viswasam kaatta yen inoruthara asinga paduthureenga......,neutral
 Avalo scene ila. Boma Padam Mari iruku.,negative
 Trailer vera level but innum trending la varala,positive
 Yuvan Anna fans hit like  here,positive
 Ayyyo thalaialva Vera lvl confirm ellaflrume RAJINIFIED,positive
 Semma trailer rajini fans oru like potuga,positive
 periya hero nu nenapah      Yenna pakereh....         Unah than,negative
 Super pa... Thalapadhy rasigar saarba vaalthukal,positive
 PANKALIKALA ADICHU THOOKALAMA 1 M LIKES KU BY THALA  MASS SOORIYA,positive
" Dislike pannavanga ellarum, Kaali oda aattatha paakatha poringa....",positive
 Felt like a 90's mass Tamil movies style,positive
 Thalaivar sema Vera leval thalaiva.....,positive
 Young man johnny patha Mari iruku,positive
 Izu vijay'da trailer'aaha irunda 30 millions aahi irukkum Ajith vayathu jaasthi aichu Adudda padaththilaavazu ilamaya nadichcha nalla irukkum,positive
" I'm Thalapathy Fan, But Ajith sir Thani gethu dhan , Masssss, apt ana name ULTIMATE STAR",neutral
 Pink Trailer Vs Nerkonda Paarvai Trailer,positive
 Remake of Hindi movie pink.good one.,positive
 Vera level... Yaaru ellam marana waiting la irrukkurathu...,positive
 Elaam songs ku dhan addict aavaaanga... Naa enna yaa trailer ku laam addict aaitan.. Can't wait...,positive
 Super Enga Thala pakka mass cfrm vera leve,positive
 Petta  uthikum visvasam hit agum,neutral
 last dialague semma.... rasikanuku advice pannitaru thala super thala,positive
 Sam C. S  Background Musica Therika Vittrkarnu Nenaikiravanga Like a podunga,neutral
 Tamilar tamilar nu soldringa. Produce pandradhuku reddy dhan kedaichara?,neutral
 Again peter hein after Odiyan....,positive
 After long time.... Dhanush + vetrimaran + gv prakash Kumar = pakka verithanam blockbuster konfirm..,positive
 Viswasam trailer parthutu nera inga varavungala hit likes,neutral
 VERA LEVEL SK ANNA MARANA WAITING ANNA MOVIE KU,negative
 Kaala na mass aah irukkanum  Kaali na massum classsum irukkanum,positive
 1m like reach aaga wait panra thala fans mass ah therika vidunga..,positive
 neraya neraya neraya neraya neraya neraya powerful voice.,positive
 ennna ba innam trending la ye varala,neutral
 It's not looks like a Ajit range of movie.,neutral
