sentence,label
 Last dialogue veraa lvl thala look kolaaa masss,positive
 Trailer merala aticithookuthu ellar vayil veralavaikuthu,positive
 padam paathutu vandu trailer paatavanga like podunga,positive
 Yebbaaa... Padam paathitu vanthu trailer paathaalum... Innum pullarikuthu,positive
 Thala mirrati vidutinga ponga thala I love you Ajith sir,positive
 clg la irundhu idha pakkuravan mattum like here,positive
 Karthi (Kaithi) Vs Vijay (Bigil) Who wins this Diwali ? . Like - Karthi (Kaithi) Comment - Vijay (Bigil),negative
 Kathi karthi fans kuthi mari eruku da punda,neutral
 Ithu than rajini padam mathiri irukku,positive
 Kaithi semmayarukum pola asuran appa bayangaram  bigil jolyarukkum,positive
 Thala vere level nenaikiravage like podunge,positive
 Happada Oru vazhiya Siva and team thalaiya vitu poitanga,positive
 Screen la vantha la Vera level,positive
 Thala is gonn bring goose bumps back,positive
 ROCKING STAR YASH fans hit like here,positive
 100 k cmt varanum frnds .... Cmt pls,positive
 Trending 29 on Srilanka after 5 days,neutral
 Thala acting Vera level neraya neraya neraya neraya neraya dialogue awesome mass &class.,positive
 please time waste pannni it KK padathukku pogathinga  semma mokka@!^@*/&:×&:^,positive
 Ipdi muttathanama padam edunga. . Urula naainga vettitu savuthunga,positive
 Vjs fan more than rajns fan hit like,positive
 Superb Shankar and super star rocks,negative
 Sk future avengers uruvaka neengathan karanama irukka poringa all the best,neutral
 Marana mass ...  Thala  fans like here,positive
 Interesting trailer Tamil la nala erukanum,positive
 Ajith vandar yellarum side ki ponga ...back with a bang.....u1,positive
 Isaac Asimov photo vechi irukkinga semma.,neutral
 58k dislike pottavan tha kadasi vasanthuku vekka padanum,positive
 andrala nama tamil peoples ah thappa pesunavan thana chai ... apave ivan mela mariyathai pochi..........,positive
 Rajinikula expiry date mudinju over expiry akiruju,neutral
 அட mokka punda aamaiinnu neega 1M likes vaangalayada.... Poy evandhaya pudichu ***ngada,negative
 Thalana thala than naan thala ser fans paaa,positive
 Mokka ya erukku trailer feel happy,neutral
 naan video paakamaye like potutenlike pota 1 hr kalichu ipo dhan trailer full ah paakurenThala masss,positive
 Super trailer Shankar sir @rajini sir @A.R.R. sir suppapu,positive
 Semma ...but...Yellam Avan seyal... Pola irukku....,neutral
 rajiniye oru nathari paya avana ivalo bildop panra neenga adhukku mela,negative
 Last dailog புரிஞ்சா inga like podunga,positive
" dai,kadaisi varaikum vidhya balan na kaatave illaye y? ajith sir ku jodi vidhya balan But avangala trailer la kaamikave illaye",neutral
 Ji likesa therikka vidunga thalaiver fans semma masssa iruku,positive
 Sema Dhanush Anna vera Leval Asura Vettai Arrambam,positive
 Trending la enga da kanom podunga da  trailera,positive
 Dhanush Anna vetrimaaran Anna 2 perum Mass Vera level,positive
 Thalapathy 64 vera levela varum pola...,neutral
 :rolling_on_the_floor_laughing::rolling_on_the_floor_laughing::rolling_on_the_floor_laughing:Trailer ah da edu edho ad patha mari eruku boost ku batman bomma kadaikura mari,neutral
 Na daily 10 times ku Mela intha trailer pakuran.last 3 days,positive
 Ithu thaan da Rajini padam .Pa.Ranjith unaku paadam.,positive
irukudhu   Very funny........,neutral
 Padam name Petta Rajini sattaila otta,positive
 Visvasam movie ah kandu pinvagiya petta,neutral
 Remake of Pink awesome movie,positive
 Shankar sir sayma Maga hit movie all best sir,positive
 Rowdyngaluku support ilama iruntha nala irukkum,positive
 0:47 - தல + U1 bgm = Goosebumps,positive
 U1 and Arujn  Fan's Like,neutral
 August 10 waiting  thala movie nerkonda paarvai,positive
" Lokesh Kanagaraj fans, leave a like",negative
 Dey idhukku yenda dislike pandrinka . Trailer semma mass ah entertaining ah thanae irukku.. vaitthu yerichallin uccham da neenka,positive
 Ithua Namma Annanukku Therija Varutha Paduvaru Namma Annavukku Eppavume Nalla Per Vaangi Tharanum So Please Stop Negative Tag,positive
 Aiyo sami antha dance movement kevalam da sami... Sirupa adakka mudiala:rolling_on_the_floor_laughing::rolling_on_the_floor_laughing::rolling_on_the_floor_laughing:,positive
 Padatha ippove pakanum pola thonuravanga like podunga,positive
 Dhanush looks like Gramathu Vayasana Thathaa :thinking_face:,positive
 This is Thalivar padam .....marana mass u u u u u u u ........,positive
 Teasarlaye oru traileraaaa teaserkullaye ivlo irukka semmmmmmmmMmmm,positive
 9.5 unlike ungalukku vera epdida padam vemum chaa itha poyu unlike pandringale,positive
 751k likes reached aairuku pangalingala adichi thookalamaa,positive
" 80's, 90's la patha super star",positive
 Trailer Vera level Padam Mass aah irukaa pothu,positive
 Epdiyae ellarayum konnuptu neeyum seththu poidu,positive
" Nawazuddin Siddiqui, pavam oru nalla nadigana kodumai padutha poringa  sad sad",positive
 இன்னும் 1 trending.. Thala da..,positive
" Maraaana masssss ,... Yappa innu Yevlo young ah iurkare .... Semmaa",positive
 Flat  proud to be a talaivar fan ! Rajinified ! Sirapana taramana sambavatha inimethan paka porom !,negative
 Lots of love from Karnataka   Hit like karthi fans,negative
 Bhavesh Joshi enna Hindi padam mathiri irukke,positive
 Ultimate Star AJITH KUMAR Vaazhga.. Thala Veriyan...,positive
 allu vittruchu thalaivaaaaaaaaaaaaaaaaaa..... ithu than marana mass.... mathavanellam waste.........,negative
 Parvaiyee Vera level la iruke....N K P...,positive
 Teaser ah vidama trailer ah vittutaga:star-struck::star-struck::star-struck::star-struck::star-struck:,positive
" Nangge thala fans da, vijay 63 kuda nangge support panuvum. Tamilan da! Ennore tamilanne kille thaliyude mathum",positive
 Naa indha trailer 30 time paathuten pakka pakka Thala maasss  Thala  dharisanam kedachirichi,positive
 I think it is same like pink movie.,positive
 Thala vera lvl thala... Luv u thalaaaaaaaaaaa,positive
 2019 Diwali treat  Bigil - like  Kaithi - cmt,neutral
 i love superstar Rajni sir.... iam vijay fan...,positive
 Thala ajith kumar Yuvan shankar raja H. Vinond Uff,positive
 2.0 Tamil Movie | bgm,positive
 Enum nala Pani irukalaam orginal pink trailerpana it's ok only,positive
 U1  FaNs  HIT LiKe,positive
 Thala ajith telugu fans hit like,positive
 Romba naaluku Aparam thalaivar...  Sema massa pakurom..... Get rajinified... .....,positive
 2.0 vs Zero ???,negative
 Enna sir ivlo azhaga vanthinga... Oru dialogue kooda pesama chumma thayya thakkanu sollitu poiteenga,positive
 U1 drums keyboard lam adichi parakka vittuttaru pola  Kola mass u1,positive
 Vera level Thalaiva  neenga mela varadu I'm like :lion: movie HIT: LIKE AVARAGE: COMMENT,positive
 Guys Ellarum Lyricsvaanga Katharalgal roba athigama irukku katharikitte irukanuga,positive
 Eyyyyyy inda no1 no2 ellam paapa vilayattu  ennakume thalaivar than no1 super one understand,positive
 730k likes reached aairuku pangalingala adichi thookalamaa ‍‍‍‍‍‍‍,negative
 Ellam ok ana last la dha...,positive
 Last ta ajith sir sonna dialoge yengala mathiri vijay anna fans ku. Orutharukku viswasama ierkurathukku yen iennoruthara kasta baduthuringa,positive
 Mokka mokka mokka trailer டா அஜித் fans பாவம் டா,negative
 Appadiye entha movie paarthaalum Sethu pathi Sir ore maathiri irukku... Ilayaraja Music Maathiri...,neutral
 Simple..... Life all time favorite thalaaaaaaaaaa,positive
" Afternoon 1:30 pm , viswasam trailer ku yarru la wait pandringa",neutral
" Thalaivar adhiradi, good looking young and pakka mass trailer",positive
 Final dialogue and previous dialogue mass.,positive
 ippadi oru mass trailer aa irrukumendre athirpakkalea,positive
 Legend of chiyaan vikarm  Vera level  Anna......,positive
 Music Harris irutha semma ya irukum,positive
 4M marana mass  pakurathuku sinna payan mathiri alaga irukiga,positive
" Jai Thala Ajith, andra Ajith fan",positive
 Suyama yosikira ovorthanu super hero than sk Anna on,neutral
 Dai sarkar la 40 million views vanthuruchu..inga 11milliyan than,positive
 Release kulla 15 million views varanum bro,positive
 Aama Mr. Pandey inga enna panraru??,positive
 Really Happy to See Rajini Sir like this..and Vijay Sethupathi Evvalo kastapattu munneri ippa indha stage ku vandhurukaru..,positive
 Thalaivaaaaaaaa.. pakka mass. Invincible style samrat,positive
" Oruthar maela viswasam kaatturadhukaga, innoruthara yaen asinga paduthureenga.....Great lines sir",positive
 11 M views innum etattum thalaivaaaa,neutral
 I Hope Hero Not Mugamoodi 2,neutral
 Yaralaa 1.5 gb video pakuruku pathame pogudhu,positive
 Looks like a 90s hollywood movie,neutral
 Ennaku Ennamo Intha Padatha Parka Yaarumey Varamaatanga Polaairukku,positive
 Thalaivar vere level..trailer eh  ipdina movie confirm marana mass,positive
 All the best sar I am karnataka,positive
 699 k  likes reached aairuku,positive
 Idhu ennada irumbu thirai part 2 ba illey idhu hero ...,positive
 664 k likes vanthuru marana massss thalaiver verithanam,positive
 Kaithi-ku CONGRATULATIONS  T-64 ku ALL THE BEST.,neutral
 Trailer hey pakka verithanama iruku padam epudi iruka pothey intha deepavali kaithi deepavali than,positive
 Indha trailer Ku kuda  dislike pana  aalungala Ellam Thiruthavey mudiyathu akka thangachi kuda porandhavanguluku intha movie puriyum,positive
 Video game trailer or movie trailer? RRR fans like here!!,positive
 Maranam Massu Maranam aduku avartha porandu varanum Thalaivar Dhanush,neutral
 Yuvan mass nu solldravanga like panunga,positive
 Romba Romba ketta payan sir intha Kalli,positive
 & Naren Press Meet At Palakkad (Kaithi Release),neutral
 Slow motion vechi arunga guys avlo details iruku,positive
 U1 bgm vere level solluravnge like podunge,positive
 Samma stylaruku thalaiva. Padam kandipa hit daa.   Jai thalaiva from ntr fans. Andra,positive
 Eanga chiyan vikaram yappo maa mass da,positive
 I am waiting waiting waiting nerkondaparavai thala movie ultimate trailor,positive
 Adappainggela... yaruda neenga... shankar sir,positive
 idhu madhiri padam dhaan karthi sir kitta irundhu venum superb,negative
 Na yethir pakkava illa thala acting,positive
 Ithaiyum mass nu solra oru kootam irukku 🤦‍🤦‍,positive
 I'm big fan sir I love you,positive
 Marvel aavuthu mairavathu SK universe daw,neutral
 SEMMA STYLISH CHIYAAN VIKRAM SIR BIG BLOCKBUSTER LOADING WISHING IN ALL THALAPATHY VIJAY,positive
 sam c vikram vedka thema vidamaatru pola irukku.,neutral
 Pink Vali Feeling    Par story me dam hai,positive
 Ellam avan saeyal ah remake pannitegala da...  Athuvaey remake thanah,negative
 Thaliva unagala matum tha ipdi gethu kata mudium World Ka oru mass..,negative
 Billa 1 BGM feel,neutral
 Super star  na adhu rajini sir mattum tha vera yarunaalayum antha patta tha vanga muditadhu da,positive
 Dis is hindi movie pink remake,neutral
" Saguni padam madhiri theriudhu,soori irukkuradha pardha romba bayama irukkudhu",neutral
 Apdiye doom trailer patha maathiriye iruku,positive
 Anil kunjigaliku 1m dislikes potu vitranum thala fans,negative
 Marana mass thalaiva atuchi thulpannu thalaiva,positive
 Ultimate tala   vera level sir neenga,positive
 Dis like potavunga pundaya muditu ponga da,positive
 Ahaaa Thalaivar style semma marana mass,positive
" sema but aniruth music sumara irukku ,,,yuvan best ah oottruparu ,,,",positive
 dislike potrukkaanga avunga amma sillukku daw,negative
 Iam surya fan but thala teser super,positive
 Ready 2 get Nxt Oscar Award... Thalaivaaaaa...,positive
 Ya iven inthe mathiri ellam pannikitthu irukkan,negative
 Ni va Thala evanum unna vella mutiyathu,neutral
 BGM    GV Prakash,positive
 Verithanam ah irukku waiting fdfs thatra like ah,positive
 I am here after 6.4 million views,neutral
 Thala fans hit like me....,positive
 October release.. Aa.... November aachu daaa,negative
 Saaho oda remix ah shakthi man ah,neutral
 1000 varusham aanalum bat parody tha panna mudiyum copy paste Panama.. suyama yosinga dir...tat too with sk..shi*,positive
 Trending no 1 in Singapore Steady la,positive
 2:01 to 2:13 dialogue for bigil,neutral
 1st Indian movie made like a Hollywood movie...,positive
 Any idea about 8.8k dislikers? :thinking_face::thinking_face:,neutral
 Asuran padam style la sollanumna.... Yennaya trailer eh ippudu irukku,negative
 Endhira logathu sundariye video song kettu vanthu trailer partha vanga like podunga,positive
 Best of luck from prithviraj fans kerala,positive
 Iru  mugan fans hit lyk,positive
" Dei, ennada,.. 'CONAIR' padatha kavuthi pota madiri iruku unga 'KAITHI'\r thiruttu payale Lokesuh????????!!!!!!!!!!!!!!!!!!!!!!!!!!!!!!!!!!!!!!!!!!!!!",positive
 Dislike ethuku da poduriga . Teast ellatha people...,neutral
 release dis film in kannada version..,positive
" V for Versatile , V for vikram",positive
 мaѕѕ  waιтιng ғor  ԹҽԵԵɑ,positive
 Idhu tamil padam mathiriye theriyala wow,neutral
 Atleast indha super hero padamachu makkal support panuvaanganu nenaikuren....sk at his atmost best..alwayss masss,positive
 Thalaiva super .vazhdukkal sangkar sir .&  2.o team,positive
 Padipa matum namma kitendhu eduka mudiyathu  looks another raw film from vetrimaran,positive
 This is true... Semma mass vikram...... :call_me_hand::call_me_hand::call_me_hand::call_me_hand:,positive
 Va thalaivaaaaa trailere evalo maaasu unna antha screenla pakumbothuDhanush blood,positive
 ayyoooo alagu alaguuuuu thalaivaaaa love uuuuuuuu sema handsome thalaivaaa,positive
 Idhan da Acting ! Kola Mass ! Saar!,positive
 Indha Mari Thalaivar pathu rombha naal Aachi get rajinified .. pakka mass trailer,positive
 trailer dra perula padathayea kaatita epdiiiii,positive
 Semma semma semma semma semma semma no words vera level,negative
 tamilrockers irukkum podhu namakku yenna bayam.....haha..,neutral
 definitely  telungu fans tha first pidikum sollirukan intha lusu.....ivan padatha theatrela pakama tamilrockersla papomnu solravanga ellam LIKE podungoooo,neutral
" SUPER STAR RAJINI MASS ...SHANKAR & TEAM , GOOD WORK..",positive
 Super star amazing i m waiting,negative
 Ena da bgm ithu yuvannnnnnnnnn rocksssssss,positive
 Next Level To Tamil Cinema Thalaivaaaaa Kalakiteenga,neutral
 Naan ellam lungi katyikit ooditta thalayadich veezhuva aanaaal !!! Evan sadharana manithan illey :star-struck::star-struck:,negative
 Thalaivar fans alert: petta trailer social media share panni view and like etanam.,neutral
 Yevanavathu Yuvan BGM pathi pesurangala nu paaru..,neutral
 Namba pasanga mass kattitanga crash agi trailer nikuthu,positive
 Intha kelattu naaya inthamari pathu rombha naalachu. Nalaarkuda trailer.,neutral
" Hit,Bigil=like       Kaithi=dislilike",neutral
 Dark knight trilogy key tough kudukkum polaye padam..!!,neutral
 Enga thalaivanna summava  Ippo paruda indha Kaali oda aatatha  Kaala mudinchu Kaali ya vandhirukaruda,positive
 2. 0  movie fans Like button Like now,positive
 Intha trailer partha piragu chiyan fan nu soldrathula perumaiya irukku.... Chiyan mass.....,positive
 2:20 pattaayaa kellepuraaru thalaivaru... movie going to awesome..,negative
 I'm thalapathy fan....romba nal kalichuu thala kku nalae padam varaee.podhuuu....manasukku ipodhaa sandhosamahhh irukkuuuu.....,positive
 10 times mela paathavanga mattum like pannunga,neutral
 Sethu anna Voice  Thalaivar Entry   Kolla Gaandu la irukan Epo varum oh nu,positive
 Maasu maranam tough uh tharanum athuku ivantha poranthu varanum ....,positive
 Action padam like pani pakravangalku kaithi goosebumps guarantee,positive
 It looks like telugu movie rangasthalam,negative
 Anyone after Darbar Chumma Kizhi song,neutral
 Thala yada dialogue delivery sema mass Vera level  goosebumps overloaded,positive
 First view and first like by selvam,positive
 Flamboyant Look - Superstar Rajnikanth,positive
 He is vera level lu bro,positive
 super trailer rei adhu radhiya iruka movie epadi irukum....,neutral
 Rajnikant fans hit like   Love from Maharashtra,neutral
 Maranam maasu maranam tuffu tharanum athuku Avan thaan poranthu varanum....,positive
 Fist ever fan made song for 2.0,negative
 Petta blockbuster avum nu solraavnga like podunga,neutral
 Akshay kumar 1st dialog olunga kekala... Ennadu paah adu ??? Cell phone vechu irruka ovovruthanu....????,neutral
 Aiyo namba mind vera angaya poguthya Sivakumar :rolling_on_the_floor_laughing:,positive
 I love Vikram movie s as kannadiga,positive
 Trailer la nallathan da irukku padam mokkaiya illama iruntha sari,positive
" It seems like mixing of aadukalam,paruthiveran,and pariyeram perumal.",negative
 Any one here to check likes after bigil 1.5 million likes,positive
 Yuvan Shankar Raja nailed it  Bgm vera level  Love you Shankar Raja,positive
 Movie superb  SEMA movie ....,positive
 Ennada trailer loose uh koodhi maari itukku,negative
 Adiye Meera ni vikram vedhala Madhavan kuda nadichavathana athan un nilama ipdi..,positive
 Super.... Super... Super... Super.... Super... Super..... Superoooooooooooooo... Super...,positive
 Yendala like picha kekkuringa,negative
" Vettu kuthu thavirthu vera mathiri story varadha, vetrimaaran., Ketta vartha illadha varaikum happy..,",positive
 Nerkonda parvai vetri pera vazthukal by nadippin nayagan surya fan,positive
 Sirappana tharamana sampavankalai inimedha pakka pora,positive
 Marana waitinggggg for another irumbu thirai,positive
 Nall cartoon padam sankarte sarakku illaiyo,negative
 Waiting for Thalaivar in darbar pongal,neutral
 Epdithan super star matum intha vayasula ipdi irukaro semma,positive
 THALA PERFORMANCE PINITAARU!!!! MAVANE NAMMA NAATUKU INTHA PADAM THEVA!!!! AUGUST 10TH THERRIKKA PODHU!,positive
 Ena Da bomma Padam eduthu vachirukeenga,neutral
 Mass ah ellama mechured ah actpanirukaru thala ana athuve bayangara mass ah erruku,positive
 Semma but teaserla ulla punchu ithula konjam koravutha,positive
 Lv u...... Vijay Sir          From Karnataka,positive
" Pwoli pwolii . Dhanush, vetrimaaran, Manju warrier :sign_of_the_horns:",positive
 1:36 *thaa enna look-u daa saami  That bgm lit,positive
" Intha trailer kum dislike poduruvan lusu koo,‍‍‍",negative
 Seems to be similar to Malayalam movie chinthaamani Kolakkese,neutral
 Last tamil subtitle yaaru rewind panni padichinga like podunga,negative
 Pangalingala rajini fanpannuvaaru thalaivar banner kilichavangaluku padhila Nan sorry ketuten neengalum mudincha ketudunga,negative
 Chennai la booking start aagiduchu movie ku,positive
 1:03....rajini appa unga stylukku innnnnnnaaaa kuratchaal...ever stylish ...no one can beat you style.,positive
 Kaithi trailer ah paarthutu Thalapathy 64 ku Verithanama wait pandravanga like pannunga,negative
 Sridevi Daughter Khushi Kapoor Met Ajith,positive
 waннн waннн waннн тнala тнala тнala   enge тнala nale мaѕѕ тan..  ѕeммeeee,positive
 Inniki target reach panniduvom Nalaiku nammaloda target 11 million views,positive
 Thalapathy64 lum vera leval ah erukkum polaye.....!,positive
 Trailer la Yenna pudikalanu dislikeexplain pannuna nalla irukum,positive
 I think its chindamani kolakkes malayalam  remake,neutral
 Haters tommorow evening Sambavam irukku Kaathirunga,positive
 Rajani sir going to be old style padayappa style:sign_of_the_horns:,positive
 Bigil marana waiting panuravanga like panunga,neutral
 komali rasini vesam pottu tamil ilichavayangala ematharan,neutral
 Entha padathalaum vivazya pirachana solraga pola oh my God,neutral
 Thaliva ni vera Laval... Love you anna,positive
 Pattaya kelapitey Siva!!!  Awesome!!!,neutral
 Ethir paartha alavu ila .. sadness,positive
 No 1 trending innum Konjam nerathu la vanthurum,positive
 Allandu sillandu fans lam odiru....this is rajinism...,negative
 this time naata vittu odurathu uruthinu nenaikiraen.,positive
 Vayasanalum unga style azhagum innum marala.... Thalaiva roxkzzzzzz,positive
 Fdfs ku poravaga like poduga,neutral
 Chutti tv paatha maathire iruku,positive
 Simran look paaaaa.chance ah illa so cute,positive
 Kola gaandu la irukaen padam paaka,positive
 Le Batman: I quits my job,positive
" Even Being A Citizen Of Andhra Pradesh,I Am Proud To Be A Die Hard Fan Of Rajini! Marana Mass.",positive
 God of bgm Yuvan mass Yuvan gethu  Yuvan bhaktargal hit like,positive
 Marana Mass vetri sir & dhanush sir I am waiting,positive
 Thala ellaa dialogkum sema mass ah iruku,positive
 Thala fansna sumava Sema union PA..... Pullarikuthu,positive
 Taramaana sambavam pongalukku irukku le,positive
 pongal rece la yaru win pannuva? likeviswasam,positive
 Gv prakash Pei aatam potrukaru... Indha Gv ya than ya Nanga edhirpakurom...  Use earphones,positive
 YouTube Ange view illa like varuthu,neutral
 BGM therika vitirukaaru yuvan vera level ajith,positive
 vijai fans + Thalaivar Fans Meet pannalama Ready start 1 2 3,neutral
 Kaithi trailer yen trending la varala,neutral
" Padam trailer mooka, padamum waste Insulting amitab  Poi sethu thola da ajith sunni",negative
 Thala pola varuma enga thala pola varuma  Thala pola varuma Thala pola varuma,positive
 My aim is lawyer but enala aga mudiyala sila karanagala but En THALAya antha lawyerla pakkurapa romba happyyyaaaa iruku,positive
 01 ON trending in sri lanka,positive
" Jithu- kaali- singaar singh veri Aatam, jan 10 mark the date , king  arrives",positive
 thatta da. aamai porumaiya poittu irukku.  innum oru 10 naal aagum 10m views ku.,negative
 Thathaavin nadippu nalla irukku 70 vayasila hero vaa ! Kadavulee makeup man a thukadaa !,negative
" Thala vera level, yuvan bgm super b",neutral
 0:48 to 1:00 yuvan  rocks,positive
 Dhanush-Vetrimaaran innum ethana padam sernthu pannaalum elaamae sorgam thaan cinema lovers ku,positive
 Bgm is not powerful like vada chennai,negative
 Neraya Neraya Neraya... Marana Mass Thala,positive
 India vula Thala kku mattum thanda mass opening his... Thala veriyanda....,positive
 Enakku iru mugan trailer gnabagam than varuthu,positive
 Maaassssssooooooooo maaaassss thalaya ipti oru puthu role la paakrapa as a thala fan romba happy ah erukku,positive
 Semma dialogues & semma dialogues delivery.. thala look like a LION man,positive
 Die heart fan of dhanush. Love u thalaivaa.... Ummmaaaaa... Padam vera levela eruka pothu...... Tq thalaivaaaa..........,neutral
 Hindi la ab tamizla ak Vera level rasigargal waiting including me,positive
 Night kulla 1M like varum nu soldravanga like pannunga,positive
 en thalaivar munadi neengalam ahhh poganda poi vera vela irundha paarunga da neengalamnu nenaikuradhey thappu da,neutral
 vera level 2.0. i am thala ajith fan,positive
 1:57 semaa thala nalle dha edhala sollamudium thagidi avaruku mattudha eruku,positive
" Eppa kutti moonji... ALL THE BEST. Unakenna pa big screen le la varuva, naanga apdiya...",positive
 Vera level anna i am marana waiting,positive
 MASS KA BAP ( THALAIVAR ),positive
 Kandippa indha padam nalla odadhu.... Idhu Vijay sedhupathi kana padam illa..,negative
 Hey naathanuh naanthan,negative
 Sarkar Deepavali vedaa idthu 2.0 DeepavaliVeera level . Hollywood level,positive
 Thalapathy 63 trailer ku yarula waiting pannure ga. ....like poringa,positive
 Bro starting dialogue la konjam thimiru irikae. Thappa irikae bro.,negative
 Fdfs ku wait pantravanga matum like....,positive
 Pongal ku kandipa 2u vidhamaana sweet saapda porom,positive
 Sweet Saapda Porom ;) Petta Pongal!!!!,positive
" pogo channel la varamari irku, thuu.",positive
 Thala ungala pathale pothum...kadaule...  evlo alagu ungala adichuka evarum illa...,positive
 Trailler pidikkadhavangalaam  like pannunga    expect panna alavukku trailer illa oknna like pannunga....,positive
 i cant believe he is 69.,positive
 sakthimaan sollidu thovaikira kallulanthu kila vilunthu adipattavanka like pannuga ( 5 thaiyal enaku ),negative
 Ithuvum caste sammantha pattatha..yennaga neengaluma... caste ah olikuren olikurenu sollitu ippdi valathutha viduringa deivame..,negative
 Otha set agala da pooolu ajith,negative
 omg ragini sir was in darjelling,neutral
 Yellarum avaroda stylea pattimattum sonenga  But 69 vayasulum avaru evalavu slim-a. Erukaru athapatthi sollalaue,neutral
 Hey it’s look like remake of HIndi PINK movie !!!,positive
 Padippa mattum nammakitta irunthu eduthukave mudiyaathu.. wow.....,positive
 Mass trailer...pettaparakkk.... Viswasam trailer from tomorrow 1.30 pm,neutral
 suttu pottalum soorivaraadhu pola,negative
 1:12 thank me later. Goosebumbs 3d :)))))))))) like,neutral
 Padam vetri pera valthukal         - sk anna fans,positive
 Dislike potavanuka amma va oda vittu okanum,negative
" Petta,viswasama underwear oda odda vida pogudu",neutral
 2:20 hit like of u luv him ..,neutral
 Pandey ku acting varala . School pasanga nadagathula nadikara adu madiri iruku pandey Voda acting. 1st film apadingaradala mannichu vitralam,neutral
 Guys Intha Fake Id Naalatha Namma Sanda Podram Anthamaari Inga Vanthu Evanavathu Katharuna Thorathi Adipom,negative
 Hahaha poi bigil trailera paarungada:face_with_hand_over_mouth: vetti payalugala.,negative
 Good morning Guys  Kaalaila Ezhunthathum Trailer Paakka Vanthavangala Like Podunga,neutral
 Dhanush Anna Maas solldravanga like podunga,positive
 2:02 sema gandilu iruken mavane kollama vidamaten  sweet sapdaporen,positive
 Link yellam share panunga unga frnds family relatives ku,positive
 Krish part 3 vanthudicha  iyooo ithukku dha ivlo naal wait pannittu irunthan    Negalum ithukku dha wait panringana  Sollunga,neutral
 Indha varusham Rendu padam Semma treat ‍‍‍‍‍‍‍‍,positive
 Iwanallam yaar wantha act panna sonna...  kilattu punda maathri irukan..  ithallam paarkanumda naan uyirodu irukan:shushing_face::shushing_face::shushing_face::rolling_on_the_floor_laughing::smiling_face_with_open_hands:,negative
 Paaaaaaa more thaaan Hollywood range... Excited to have watch over it,neutral
 That Bgm is lit... Marana waiting thalaivaaaaa,positive
 Movie vera level.  Thala sema quote,positive
 Thalaivaaaaaaaaaaaaaa noorayiram aandugal podhume un ragame padume Semma Semma,positive
 Thalaivaaa . . .. . . marana paa... .. . .,positive
