sentence,label
 Idha nambi thaan da theatre ku vanden.. Kadaisila naamatha potingaley da :person_facepalming: :person_facepalming:,positive
 Dislike podura alavaku intha trailer yathum illa so :star-struck:,positive
 Suyama sindhika therinjavan super hero Siva Anna mass dialogue:smiling_face_with_hearts::star-struck:,positive
 Namaku thevayanadha naama dhan adichu vanganum,positive
 enaku ennamo entha movie than dipawali theriga vida pokuthunu ninaikiran,neutral
 Antha alavuku elam onum ela nu nenaikuravanga like panunga.,positive
 To haters in Lollu sabha style : Arivu ketta eruma maadu,negative
 Ada pavingala. .... Iwlo charming ah iruke da... Saaptinga trailer laye,neutral
 THALAIVAAAAA PLEASE KEEP DOING MOVIES! YOUR MASS IS UNMATCHABLE!,positive
 Sk anna vera leval   Yuvan music mass     Verithanam overload,positive
 Dhanush Vetrimaran Gv  Yathuku pa promosion panununum Panamala  akum Movie  Don't worry,positive
 Twitter la trending la therikaa vidrom,positive
 Serapana tharamana padaithai enemel thaan parka porom,positive
 Best look chiyaan Vikram love from Bangladesh,positive
 Innum trailer ra paakaravaga hit lik....,positive
 Talaiva you are always super,positive
 Dislike poota Vijay anna fans Hit Like,positive
 U1 BGM massssssss verala level thala look semaaaaaa,positive
 Telugu audience..... Fans from Andhra.... Rajani sir keka....,neutral
 Adei.. Ivar pesaura ella dailogue um Kusuvasam ku daan dedicate pola,negative
 Vs anna semma.......:smiling_face_with_open_hands:epavum pola neega vera level.........,positive
 Aiyaiyooooo thalaivaaaaaaaaaaaaaaaaa Marana Mass...Vera leavel ... trailer summa thearikka viduthu.trailere apdinna movie summa velluthukattumI am waiting,positive
 I love sivakarthikeyan  Sivakarthikeyan fans like pannunga,positive
 ajith ah vida rajini  youngah theriraru petta movie la.... maranam mass pongal,positive
 but it does not meet sarkar view records,positive
 Neraya neraya neraya wait seiram thala,positive
 Pirabu and naasar very good acting in Piriyanka tamil movie But aigth and Pandey moka acting.,negative
 Tamilcinema Na ennanu kaatanum get Ready audience,positive
 Thala na thala tha pada semma hit,positive
 Thuuku dhurai on Next level,positive
" Innum neraya neraya nerya, neraya views varanum.... Thala Rock",positive
 Dei dislikers vayiru erinji saavunga da,positive
 2.29 thalaivar dance like bijili ramesh...............hit like if u feel same.....,neutral
 Thala mass vera level trailer Thala Vaazhga sema dialogue awesome,positive
 Nejamave vayasanalum unga styleum azhagum ungala vitu pogala .... Thalaivar different range la Erukaru super ....,negative
 Indha padam tamil natuku Kandipa theva super thala,positive
 Trending in sri lanka.. I am very happy. Hit like..,positive
 OMG... Pakkka mass... Vera level... Thalaivaaa... I love u...,positive
 Thala vara level Thala pola varuma,positive
" Indha trailerkagave 150 kudukalaamya, 20 vaatiku mela paathuten, Thalaiva Karthik Subburaju enga Super Stara getha kaatirukaya",positive
 Thala mass bgm pakka mass thala and Yuvan masssssss,positive
 U1 bgm theri mass. Bgmukahavay movie paakkanum,positive
 Sankar sir kku thanks solla nu,positive
 Avara control panunga pls semmmmmmmmaaaa mass,positive
 Karthi thalaiva....vera level....block buster aaga valthukkal:partying_face:,positive
 Asuran verithanamkaadu eruntha eduthukuvanga ..kasu eruntha pudikiruvanga ...ana padipa maittum namba kitta eduthukavae mudiyathu ....,positive
 Love u viji anna Blockbuster trailor,positive
 Arasiyaluku Pogama... Superstar vey irundunga... Pls,positive
 Anyone here even in 2019 july,negative
 Love you rajinikanth sir super star,positive
 Thalaivar na summa va  fire,positive
 Bayya trailer adirindhi kachithanga bahubali ni dahtutundhi,neutral
 Super good .. like a Hollywood movie,positive
 Nee engitta vilayaada la yeman kitta,positive
" 92k views but 142k likes, how is it possible :exploding_head:",positive
" 1:36 U kena tunggu lebih lama lagi, untuk tahu saya...",negative
 chinna pulla thanamaala irukku graphics! XD XD,positive
 Anna Ajith vera level enga Thala pola enga yaru ma illa Thala daa,positive
 Omg .. use head phones Enna bgm da saami ..,positive
 Oru pakkam paiyan swag kaatran oru pakkam appan swag kaatran,positive
 Karthi awaken.. Suriya is a fool..,neutral
 Angali pangali Ellarum attendance podunga,positive
 En thalaivi Vidya balan enga da?,positive
" Deivamae na expect panna rajini padam ethu tha not 2.o, kaala, kabali",positive
 Thalaivaa kola mass Vera leavel,positive
 Trailer naa ipti irukanu kappan nu oru trailer vittangale oru feel ye kedaikala athula irunthu... Chai,negative
 Evanachum trailer epadi irukunu solltrana paru:rolling_on_the_floor_laughing:,positive
 Annanu angu keralavilum und katta fan base,negative
 da 700k like  mukuthu very bad,negative
 Thala.... intha marie different ah ippa than pakurin... pakavey puthusa eruku...... aug10 vara wait pananuma,positive
 All Karthi Anna Fans mass Diwali Nammaldhu dha otha Verithanamana sambavam iruku...,neutral
 Is he like anit hero in this film.... But semaya iruku.. Chiyaan ipdi paaka,positive
 sema ultimate trailer . i m so so exited.,positive
 Evano indha video ku dislike button amuka vandhurundha odiru :rolling_on_the_floor_laughing: kolaa kaandu la irukan kollama vida matan,negative
 Aduchu Underwearoda odaa vitruvan.......... to viswasam,neutral
 Hero trailer semme ji  Mugammudi jeeva movie mathiri sothepiratingge,positive
 Shaktiman madripunda aga poren sakadai kelavan,negative
" best wishes to the team! 'saavaratha iruntha sanda pottu saavanum sir, kaalila vizhundhu saava koodathu'",positive
 @1:40 enna harris bgm lam varudhu :) ?? Therikkudhu Yuvan bgm..,positive
 Ennna voice da.... Semmmmmaaaa.. Thala always rock,positive
 Thala veriyans hit like for NKP,positive
 Arjun sir hero level  mass,positive
 Intha Movie SK career la Ramba Important ana Movie ah irukumnu nenaikaravanga Oru Like podunga...,positive
 Theeran Adhigaaram Ondru Fans Hit Like Here,neutral
" Evanavathu Trailer Nalah iruku,Intha frame nalah irukunu solranah paru....Hit Like nu Varanunga Youtube ah da ithu..",neutral
 Amy Jackson pakka vanthaven la like  podunka,positive
 Ek building aur ek field..pe hi puri film dikha diya..lol,negative
 Indha trailer pudichavanga like podunga,positive
 Im in Karnataka  but I  love  vijay sethupathi love you  sir,positive
 Tamil nattula intha getup la nadikka evanukkuda thillu irukku     ellam ota up uh,positive
 Akshara Hasan... Acting is not ur thing.. SERIOUSLY!!!!!,negative
 UltimateStar - Thala vera vera vera level NERKONDAPAARVAI,positive
 Oru oru scenum goosebumps ahh iruku petta parak:sign_of_the_horns::sign_of_the_horns:like podunga trailer pathu goosebumps anuvanga,positive
 Man of steel bgm semmaya eruka,positive
" Movie, movie, movie. Endangered eppadi erukiringa",positive
 Namaku thevayanathu nammatha adichi vaanganum...  masssssssss,positive
 Ethana thadava paathalum bore adikala....,positive
 Last dialogue kettuttu poi thooku Matti thongungada:face_with_raised_eyebrow:,positive
 Deiiii  ennada panni vachi irukeenga .....,positive
 vera level Thalaivaa... sirapana tharamana sambavam... waiting,positive
 @1.10 dhanus looks remain Kamal Hassan look in virumandi.,positive
 Thala 60 title ku verithanama wait panravanga matum like panunga,positive
 Sila podi payyan koode yellampannuranga thalaivare.... entha vayasile avan eallam uyiroda  eruppano..:thinking_face::thinking_face:,neutral
 Nejamavae sema trailer..... Dhanush--vetrimaaran....... Kalaiyum kaviyum vivasayathin paguthi  puthumai padappu... Asuran....,positive
 Massssssssss... THANKS FOR BRINGING OUR THALAIVAR BACK..,positive
 Oruthar Mela Neenga Viswasam kaatrathukaga Innoruthar enn Asinga paduthu ringa,positive
 What a trailer Rajinikanth Sir is again back,positive
 Ithu varaikum evlo vadai suturikinga....   Niraiya Niraiya Niraiya Niraiya...,negative
 Bayagarama kathuvanga aamaians indha trailer paththu,positive
" padam parthu vanthu,, trailer pakreven inga oru like ah podu..",neutral
 Guyzz 1m likes vara varaikum vitraadheenga...,positive
 Kadaram... Enna karumam da idhu :sneezing_face: FLOP !!,negative
 Mass na Marana massu da  Thalapathy fans,positive
 100 times  pathavanga like podunga,neutral
 Frndzzz video share panna venam link Matty share pannunga bro,positive
 Vera level thalaivaaa... trailer pathu padatha theatre la pakka anga vittutingaa,positive
 Wow vera level unmai ah ve,neutral
 Thalaivaaa one & only super star,positive
 Asuran second part veynum nu solranvnga like pannuga,positive
 At 1:01 bgm is like arambam,positive
 Thala fans anaivarum oru like podunga,positive
 Thala fan's la oru like podunga,positive
 2020 oliymbic india gold varuma silvar varuma parunga.,neutral
 Vijay Anna I m waiting na... Mass kadrenga...,positive
 Ena da nadakuthu inga.. Epaaa sathiyamaa edir pakatha trailer.. TOTALLY UNIMAGINABLE TRAILER. THALIVAR,positive
 Aathi Annan Ironman eh saaptruvaaru polayaeee,positive
 Oruthar mela viswasam katradhukku mathavangala yen asinga paduthurenga... Hats off dialogue thala....,positive
 Thala fans like potu tu poge,positive
 purinchukkanga bosss oruthar mela visawasam katta inooruvarai asinkapadutateenga..thalaye sollittar,positive
 Guys Ellarum lyricsKu vaanga neriyaperoda Katharalgal adhigama irukku,positive
 Manju warrier Vadachennai Andriya vuku duff kodupanga pola,positive
 bigil apparam yaru pakkranga oru like podunge,positive
 Thala look Vera level LA eruku,positive
 Stylea erukana ha ha naturally,positive
 Fan of super  star @Telangana,positive
 Adai fansu kadishi dilog ungaluku thaa da,positive
 Indha padathukku mak ah  Sokka yoscheenga director sir. Nalla vela.,positive
 Bad man padatha pathuruparu pola director,positive
 Thala pol varumaa...Veri Level !,positive
 Adei ** trailer ku ethukuda Advertisement??,negative
 sawudu tholanchi flim industrye kevalam paduthuran.,negative
 Villane kollan chittiye irakkunnu..chitty parajayappedumbo avanil red chip vechu 2.0 aakkunnu...thats all...,neutral
 Podu sakka mass na sivakarthikeyan  Yaarlam Heri hit nu nenaikinga and Hero na like  Thambi na comment,positive
 Enuma da evaru china paiyana irukaru.....,neutral
 VERITHANAM But I felt like MAD MAX FURY ROAD movie,negative
 Thala rasigan in vayalur pudhunagar SHACKARSH,positive
 Siva is one veraa level guy,positive
 Yaarella Tee Jay note panigeh fans oru like podungeh :star-struck::star-struck::star-struck:,positive
 Kaithi Deepavali realise I am waiting,negative
 2020 Thalapthy Vijay   Makkal selvan Vijay sethupathy,neutral
 SUPERSTAR Rajini SEMA SPEED And ENERGY Seems Like A YOUNG HORSE,positive
 Seth'a sanda potu saganam mass dilouge .....,negative
" Sad to say, but seems like rekka 2....hope I'm wrong!",neutral
 Vera Laval BGM thala for u1,positive
 Ppaaa yenna style. Thalaivar yeppavum mass intha time marana mass. KS bro tq.....,neutral
 Thatha ku jodiya paatis Padam nalla irrukum pola,neutral
 BGM Nerkonda Paarvai Madhiri eh iruke,negative
 Hahaha ena style ya kolla gaandlaruka,positive
 idhu Hindi movie PINK oda remake pa. adhula amitab bachan and tapssee act pannirupanga,neutral
 vijay sethupathi ah sariya kataleya iam mode out hw many r nt satisfied hit a like.......,positive
 y innum trending la varalaa ???,positive
 Sathiyama soldran ivarku vasayae agala...ena oru energy at this age...,positive
 Mokka film lam Diwali Ku vanthu vasool pannuthu ....am waiting for kaithi....,neutral
 Aiyo yenga veetla chutti TV varathey!!,positive
 Thalaivar pongal begins :sign_of_the_horns::sign_of_the_horns: petta paraak,positive
 Avengers range ki irrukunu nu who agree,positive
 Thala Vera 11....Movie Vantha Odane Semmaya Darisanam Panna vendiyathuthan...Vishwasam 7 Times Paathen...NKP ah Epdiyu 10 Times paathuruven,positive
 Hit like if ur missing SANA,positive
 Dislike pottu kadupetararu my Lord,positive
 Video Pakrathuku munnadiye Like pannavanga mattum Kai ah thookunga,positive
 Thala love you so much vera level ummmmaaaaa Thala Mass ultimate  Thala...  king maker...,positive
 thala oda verithanamana  fans like panuga na unga kitta pesanum pa,positive
 Vadachennai left la poirum polaye. Vetri nailed it,positive
 Super vettri maran nalae gaethu dhan,positive
 Murattu kala bro Kalli aattam petta,positive
 Super thalaiva.... Nee mass dha eppavume,positive
 All thalaivar fans.. tamil talkies maran namma thalaivar pathipanirukan.... avana konjam vezhuthu kattunga pls....,negative
 Starting romba scenu but paravala.... Nice....,positive
 Woooooooww New Thalaaa semmmmma maas :smiling_face_with_open_hands:,positive
 70 vadu vayasulayum  herova nadikka namma thalaivar super star rajiniyal mattume mudiyum valga thalaivar,positive
 Enga ore star thalaivar super star rajinikanth massss Vera leaval thalaiva mass pakka massssss,positive
 Comment padikka vanthavunga mattum  like podunga,neutral
 Thala ungalukku intha padam worth illa,negative
 Rangraj Pandey  Ennaya Pandra Court la ?! Over aah Pesuna Court aah Vittu Kuda Thorathida Poranga :face_with_hand_over_mouth: ..,positive
 3 days trending  no 1 srilanaka,positive
 0.43 nee yaaruda komaali fame Jainth,negative
 Last line THALA THALAPATHY FAN FIGHT DIALOGUESYNC1:55,positive
 Jai super star Rajinikanth sir Akshay Kumar sir and the genius Shankar sir,positive
 Dislikes podura thevidiya kandara oooooooli pasangala,negative
 Am sasikumar big fan so i like the move,positive
 Who's here after visvasam trailer ?,neutral
 Rajini - Shankar fans hit like,positive
 Mavamey kollama vidamate... ipo sweet sapaporom,positive
 Thala acting vera level nu solravanga oru like ah podunga,positive
 plsto politics  petta- best entertainer,neutral
 Black sheep kutty moonji vivek fans hite like,positive
 Vijay sethupathi is always mass.... Avaru kaha vena poi pakalam.... Makkal selvan vijay sethupathi,positive
 Family sentiment... Pondatti pullainga... Engayo link aavuthe Sun pictures nalla panringa  THALAIVAR DHARISANAM,positive
 Kamal'kaga ellam illa.. only chiyan.. chiyan Vikram,positive
" Apram yen suyama sindhikkaama, batmana copy panirkeenga ? Tell me.",positive
 Kaipulla Vijay Twitter la Trending la,positive
 Yuvan thala rasikar like therikka viduka,positive
 Emma Climaxla enna twistu . Karthick Subburaj senjurukappla.,positive
 Final dialogue. ....namma ellarkume dha. .......dread lovr5,positive
 Die hard thala fans hit like here,positive
 Thalapathi fans sarpaga padam vetri pera valthukal thala fans....,positive
 Thala padam karuththu athigama tha irukkum,positive
 LOVE YOU KARTHI ANNAA... UMMMAA......Therikka vidrom..:sign_of_the_horns::sign_of_the_horns::sign_of_the_horns:,positive
" thalaiva unna paathona uyir poiyudichu...yenna Mazz,yenna class,yenna style...RAJINISM CONFIRMED",positive
 verithanam thalaivaaaa entha varudamum namba thaaaaa,positive
 Kajal  Fans Subscribe,positive
 Teaser pathutu olu otavanungala  oora vitu odungada,negative
 Oruthar kita unmaiyaa irukka inoruthara uthasana paduthiringaa semaa dialogue,neutral
 Luv Uuuuuu ThalaaaaaaaaaaaaaaSouth Indian Ruling lion AJITHKUMAR :call_me_hand::call_me_hand::call_me_hand::sign_of_the_horns: Haters,positive
" Indha maadri ponnungalukku ipdi dhan nadakkum... - No, apdi nadakka kudaadhu.  KUDOS TO THE SCRIPT WRITER.",neutral
" Excellent film, last dialogue vera level",positive
 ethana peru indha trailer ah 50times ku mela patheenga ?,positive
 Rajni oru varthai kooda tamil pesala... arumai...,positive
 2.0 trailer semma semma semma semma Mass Mass,positive
 Podu podu podu podu podu... vera level trailer,neutral
 Vikram Vedha 2 Rajini vs Sethupathi,positive
 Shankerr 2050 lo.putali asalu talant super rajni yakting kekaaa,positive
" Enna manusanya,acting parthalle pullarikkuthu.. Danish  fan from srilanka",positive
 I love you thala marana mass,positive
 U1 BGM pudichavanga like pannunga,positive
 Vera levellllllllllllll all the best shankar sir ur a legend,negative
 Dai Enna da Enna  Thala Ipdi Masss ah Kattiringa  Avaavavavavavavvavavavava,positive
 Yuvan bgm ... Ajith sir just rocked....,positive
 Thalaivar fans hit like here !! Petta @Marana Massssss,positive
 Viewers of 31.12.2018 give a like here.,neutral
 petta padam vera level. marana mass da idhu rajini gethu gethu thanda. TM AUDIO GURU,neutral
 anils dislikes  school la irundhu vandhutu irukunga,neutral
 Adiiii super ma :star-struck: happie dewali,positive
 Semmaiya irukinga thalaiva. Super trailer. Inthavaati Petta pongal,positive
 Oruthar mela vishwasam kattuvatharkaga Ennoruvarai en asigampaduthuring ...Good dialogue..,positive
 Awesome trailer ...bro   Final dialogue is    Saaguradhaa irundhaalum sandai pottu saganum,positive
 Intha trailer pathapo yarkellam kaththi trailer njyavagathuk vanthidch,neutral
 Nice :smiling_face_with_hearts::smiling_face_with_hearts::smiling_face_with_hearts:... But rekka... Sindupath Mari irukama iruntha seri,neutral
 Mass thalai va nenga vera level,positive
 sivakarthikeyan & yuvan shankar raja       \r Fans Hit like,positive
 Enna Style u.. Enna Screen Presence u..  Pesama Arjun Reddy Remake Ivare Pannirukalam Pola..,positive
 Oruthavanga mela visvasam katrathukaga inoruthavanga yen asinga paduthuringa,positive
 hey waste ingla poi visvasam trailer parungada....1m likes.waste da neengalm...,neutral
 Thalapathy fan and i say pakka masss,positive
 Petta superstarKu nanum fandhan but nan vijay anna fan,positive
 semma thalaiva marana geththa erukinga u always geththu...,positive
 Bgm super vetrimaran movie na vera levela padam irukum,positive
 Neraya neraya neraya neraya.. Thala dialogue,positive
 thanks karthik sir  super ultimate trailer,positive
" Semma  , vera leval thala",positive
 Padam Kandippa super hit Agum,positive
 Thala padathaula mattum NerKondaParvai illa da nijathulayum thala thaan eppavumey geththa solluvrn thala veriyan nu,positive
 Last dialogue for vijay fans,positive
 That guy:Ippa namma enna panna porom?? Thalaivar:Sweet saapida porom... Vera level...,positive
 Karthi sir look like first movie yuganiki okkadu ALL THE BEST sammaya iruke,neutral
 90's kid sakthiman fans ....hit like ....,positive
 Thala Vera Level Maas  U1 Bgm Ultimate,positive
" Ethukku ethellam..! Vvs,rajini muruganmovie pathuttu...! Entha movie pakka mudiuma.....?",neutral
 All the best lokesh kanagaraj Thalapathy 64 Vera level ahh irukanum Thalapathy ahhh mass ahh katanum,negative
" thalaivaaaaaaaaaaaaaaaaaaaaaaaaaaaaaaaaaaaaaaaaaaaaaaaa semma look, style, 100% blouckbusters",positive
 Last line vera lvl  bangam.......love u thaala,positive
 Sirappana tharanamaana sambavatha idhukkapparam thaaa paakka pora,positive
 Gv music hit like tha vera level,positive
 Petta 713K LIKES Nerkonda paarvai 721K LIKES,neutral
 dislike Potta Neenga Ellarum padam paaka thaguthi illadhavanga,negative
"pathi peru sk,u1,arjun,sakthimanetc..fans like pana solvanga.yanda.",negative
 yuvan bgm ah therika vitturukaru,positive
 Karthi Anna fans kill like button :love-you_gesture:,negative
 Manju chechiiiiii njangal katta waiting aanu....,positive
 Pink movie ka south remake,positive
 Second part erekuma ? Good making,positive
 Rajani looks ultra maaaaaaas ... Style king  U r welcum to TN And Karnataka boss  Dr.Rajkumar fans Bengaluru,positive
 Sridevi Daughter Khushi Kapoor Met Ajith,positive
 Omg thala neenga vera level,positive
 Pandaee.... jii neega yepa padau nadika vantheenga.....,positive
 Trailer pakara apo kanithan movie feel varudhu,neutral
 Sahoo teaser ah adichu thookalama thala fans ..,positive
" “Centiments irundha appidiye odi poidu, kola gandula iruken mavane kollam uda maten”. Visvasam padatha than solraru",negative
 Last dialogue sema I am a Vijay fan fans kaga sonna Mary iruku sema thala,positive
 Adaiii idule engada mass  Iruku_:thinking_face: Manasacchiya thottu  Sollunga papom_,neutral
 Vijay & SK Mutual Fans Like pannunga...,neutral
 Thala suprr.... oruthar mela viswasama irukkarthukku innorthara en asingapaduthanam,neutral
 Gaming king gopi fans like here,neutral
 Vera leval thalaivaa 2019 pongal blockbuster,positive
 VIJAY FANS NEXT 2020 DEEPAWALI WORLD RECORD NERAYA PADAIPOM BY THALA MASS SOORIYA,positive
 Kandasamy and Mugamoodi mixed nu nenaikre....,positive
 indha no 1 no 2la Pappas villaiattu super star is a no one and super one,positive
 Waiting for 2 million likes varum solravaga thala fans hit like button,positive
 Sama dailogue.... Namaloda padipa mattum yevanalayum yeduka mudiyathu,positive
 Idhuku siva kumar sira kupdama vittutanga,positive
 Ippa inna Panna poram pongalukku petta parak,positive
 Konjam mathungada othaunakae theriyadha like dhan varum.Gotha,negative
 ippo intha trailer ah parkura thala fans oru like podunga,positive
 Vera level Thalaiva nee mattum eppaume mass...,positive
 32k anil fans.. i mean wig anil fans,negative
 Yaaro oru group ..Padam flop dhan konja naalu ku .Munadi ..koovitu irundhanga ..Avanga laam konjam line la vanga,positive
 Vagina fanskala savunkada... Thalaivar Kodi parakura edathula Vera Evan kodida parakum,negative
 Thalaiva va unaoda theme songa na ya chennal la pota pora,positive
 Paka thana pora entha kaali oda atathae,positive
 Dei Antha Paravaya paathale mersal ah irruku da,negative
 Thalaivaaaaa. Super style.. love you..I am RAJINIFIED..,positive
 Thala super na  like  panuga,positive
 On fire thailaivar...sirapana tharamana sambavangaka inime thaan pakaporinga,positive
 g.v prakash music ku i am like,positive
 I am ViJaY fan but Vera Vera level,positive
 20+ times pathuta thalaivaa..evalo times pathalum pathute irukalamnu thonuthu.,positive
 i think this movie will beat dangal&bahubali 2,negative
 Enada Opening Avengets  oda Music potu Irukinga.,neutral
 I am  vijay anna fan. Its amazing. Semma  thala sir.,positive
 Ithu Peru thaan pakka mass.....woww goosebumbs,positive
 Thal nee vera level nee vaa thala,positive
 Yethaiyum copy pannala but romba mepokka erukku,neutral
 Super dance semmaya irruka podhu this ponhal,positive
" Idhu padam, adha vitutu viswasam,vivegam nu.",neutral
" Thalaivaaaa ... 70 vayasu la nenache paaka mudiyadha energy,style  ..maranana mass",neutral
 Omalla mass u da ! Gethu da !,positive
 I wonder Why dis video s not trending ???,neutral
 Kaithi Eh Ippadi Na Appea Thalapati 64 ?? Dei Naan Thala Fan da Eanake Veari Asguthu !!,neutral
 Thala yoda last dialog sema mass Vera level  Thala always great,positive
 BOOKED TICKETS... THURSDAY EVENING SHOW,positive
 Avengers end game a keduthan ippa director pariu kuduka pooran,negative
 Thala &like panravanga like here,positive
 Ippe likes kettu oru koranggu koottam varanume!?,neutral
 Indha Mari ponungluku laan indha Mari dhan nadakum  Apadi laan nadakadhu  nadaka kudadhu,neutral
 THalaiva pink ah Vida Vera level....,positive
 Iam dhanush fan but I like super star,positive
 We need one Rajinikanth in Afghanistan lol,neutral
 Music Verithanam nu Solravanga Oru Like ah podunga,positive
 Pink movie remake. ajith sir pls dont do remake  movies,positive
 Anyone after darbar motion poster lile it :sign_of_the_horns::sign_of_the_horns::sign_of_the_horns::sign_of_the_horns::sign_of_the_horns::sign_of_the_horns::sign_of_the_horns::sign_of_the_horns:,neutral
 Activated scenes semmaya iruku thalaaaa daaaaa,positive
 Ippo yarlam vanthu teaser pathinga  avangalam oru like podunga ........,positive
 Enth look aado oru raksha ella,positive
 I'm Chitti  Reloaded version 2.0,neutral
 Dai vaanga daw zero trailer paathingala,neutral
 Video paakamale dislike poda mudiyathaa.....you tube la appadi oru option kondu vanga intha karumathala paakka mudila.....hathaa....:rolling_on_the_floor_laughing::rolling_on_the_floor_laughing::rolling_on_the_floor_laughing:.....,negative
 Ghibran is very unique music composer,positive
 I hate dhanush like maarii ..3...but beared thanush maaaas,positive
 suspect peru dilli. i am waiting for kaithi.,negative
 Enna da 2days ku mela aguthu innum 1miliyan like varala. Eppo than varum 3 month apram ahh..,positive
 Ha ah ha ha ah ah. Amaaaaaaaaaaaaaaaaaadioooo. Samaaaaaaaaaaaaaa,positive
 Love Rajini but trailer innum konjam strong ah irkanum,neutral
 Kalaila elundha vudane Pallu Kooda valakama nera YouTube pakam vandha thala fanspannunga ‍‍‍‍‍‍‍‍,positive
 Thala girl fans iku romba piducha padam aa amaiya valthugal,positive
 Girl voice over oda trailer niruthirukalam,neutral
 Ningalum unna client in than poi soltringa,positive
 Reviews pathutu vanthavanga yarrellam  August 8 ku waiting  Bharath Subramanian entry (Thala name in NKP),positive
 Petta 1 Trending on Singapore :),positive
 Rajni Vijay sethupathi nawaz  Petta,positive
 Innum naraya naraya naraya naraya thadava pakkanum,positive
 Ipavum repeat laiyae dan irukku,neutral
 Thala ajith sir eppawum maasss,positive
 lets make it most liked video of youtube !!!,neutral
 Padan ellam nalla than irikkr but bigiloda poatti podradhudhan neenga aeira periiiiiya thappu ..,positive
 Sema sir inimel ipadi oru padam varadhu,positive
 Pink movie!!! supr movie  thala blockbuster,neutral
 Vera level pa trailer ... Viswasam mudichitu kandipa petta porom,positive
" Nadicha pothu Vera Vena. , Arasiyal Vena",neutral
 asuran mari lam...asuran than  dislikers lam movies pakuratha vitutu vera vela poi parunga,positive
 Rajni sirrrrrr u r evergreen,positive
 ithukku peru thaan thalaivar athiradi  petta paraak,positive
 Thalaiva née eppa va ne style tha,positive
 appadiye ean channel ku oru sub podunga,positive
 Enna pa  bat man ah,positive
" Aadukalam, pudhuppetai, kaadhal kondein, polladhavan, vada channai,  then- ASURAN",positive
 Thalaivar ra ethu eyankkanna ennala namba mudiyala pakka mass i u love Thalaiva,positive
 As usual girls ku jaldra....the climax is ponuga nalavanga....pasanga kettavanga,positive
" younger look ,superstar Rajni sir, ..!!",positive
 Thalaivaaa unkalukku age 20ku mela akathu pola..sathipatharku  vayasu thevai illai,positive
 real rajini movie ..tis s want we want,positive
" Yow innaya ithu ,,,,shankarala mattum than ippadi mudiyum semma weight",positive
 Hindi serial mari iruku,positive
